id,name,country_code,country_name,state_province,city,registration_id,registration_type,description,website,email,phone,framework_area,ntee_code,icnpo_code,source,source_id,last_filing_year,annual_revenue,employee_count,lat,lon,model_type,tags,alignment_score,evidence_url,evidence_quote,last_verified_at
904100,Sustainable Harborough Community,,England: Midlands | United Kingdom,LEC,Market Harborough,,,"Sustainable Harborough Community has been at the forefront of the environmental movement in Market Harborough and Harborough District since 2007. Originally known as Transition Town Market Harborough, we became the 22nd town to join the national and international Transition Town movement. ​We are a collaboration of communities and individuals coming together to reimagine and rebuild our world, caring for one another, our community and our planet. We are focussed on developing the ideas, dreams, partnerships and projects which will enable this to happen. Embracing the three tenets of the Transition Town Movement - Head, Heart, Hands - We aim to bring together reliable information and compassionate people to form active teams who can effect real positive change on the environmental, economic and social health of the Harborough District. ​We are committee led and welcome people of hope and action.",https://www.sustainableharboroughcommunity.co.uk/,,,energy_digital,,,transition_network,518,,,,52.472767,-0.920387,collective,"Transition Group, Nature, Festivals, fairs or events, Building local networks, Energy, Transport",3,https://maps.transitionnetwork.org/group/market-harborough/,,
903464,Sustainable Keswick,,England: The North | United Kingdom,,Threlkeld,,,"Hello. I am a member of Sustainable Keswick. We were founded in 2007 by a group of volunteers in Keswick and surrounding villages and have continued for 13 years to help with local research, education and action on the threat of climate change. We would like to join the Transition Network to better communicate with our peers and allow local people to find us. Also to help educate ourselves more on the threat of climate change. We organise many activities around the area, including our Green Get Together's, which are open to the public, and invite speakers to discuss topics related to the threat of climate change to encourage and educate local people. We are also close with local businesses and offer our knowledge and time to encourage change from &#8216;business as usual' that may be affecting the environment. Currently on the initiative for a community solar panel project. I look forward to hearing from you. Many thanks, Robyn",http://www.sustainablekeswick.org.uk,,,energy_digital,,,transition_network,6051,,,,54.6009089,-3.1372833,collective,"Transition Group, Nature, Community hub or activities, Youth or education projects, Energy, Transport",3,https://maps.transitionnetwork.org/group/sustainable-keswick-to-join-transition-network/,,
903397,Sustainable Kirtlington,,England: Midlands | United Kingdom,Oxfordshire,Kidlington,,,"Our community group was set up in 2007, with an initial focus on energy: energy efficiency and energy generation. We have worked with the Eco Reps at the local primary school since that time. We have involved the community in various projects and regularly through talks and films and articles in every issue of the Village News. We have held an apple-pressing day in the autumn and until recently we had wood-processing days, where we chopped and split wood donated by villagers for sale as firewood, generating funds for various projects in the village, such as improving the biodiversity of the pond and promoting the Hedgehog Street initiative. We are currently focused on two major projects: our community orchard, with regular maintenance activities (weeding, mulching, scything and watering) and setting up a community shop and café. These two initiatives have their own action groups, but Sustainable Kirtlington acts as an umbrella organisation. We have followed the growth of the Transition Network with great interest and feel that becoming part of it would give our activities a new focus and release new energies in the community.",http://www.kirtlingtonshop.org.uk,,,energy_digital,,,transition_network,6316,,,,51.8711918,-1.2773323,collective,"Transition Group, Nature, Community hub or activities, Community visioning / imagination work, Local economy or new economy projects, Wellbeing or Inner Transition, Energy",3,https://maps.transitionnetwork.org/group/sustainable-kirtlington/,,
903207,Sustainable Nantwich,,England: The North | United Kingdom,Cheshire,Nantwich,,,"Sustainable Nantwich is a volunteer-led network based in Nantwich, Cheshire (United Kingdom) which aims to advance local action in response to the three main planetary crises that humanity currently faces: climate change, pollution, and biodiversity loss. Our story so far… Plastic free Nantwich was launched in March 2019 by local residents Emilie Janman and Jeremy Herbert. After 6 months the group realised that we were working on lots of projects which had far reaching implications and did not just focus on plastic waste in Nantwich so together we launched Sustainable Nantwich in January 2020 of which Plastic Free Nantwich is one of the main subgroups. Bad timing with the pandemic… as we had just begun to engage many stakeholders in the community, but we started up our campaigning again at the beginning of 2021. During the pandemic we kept up communication with Nantwich Town Council and encouraged them to declare a climate emergency. Sadly, Emilie moved to Cornwall in August 2021 but we soldiered on and Sustainable Nantwich is now coordinated by a small group of volunteers (who are always on the lookout for more hands!). Sustainable Nantwich does not work in isolation but works alongside Nantwich Town Council and many other community groups in the town. Working closely with other organisations Sustainable Nantwich is involved in the following projects: Plastic Free Nantwich Refill Nantwich Nantwich Sunflower Challenge Nantwich One Plan Nantwich Town Council Climate Change ...",https://www.nantwichtowncouncil.gov.uk/sustainable-nantwich/,,,food,,,transition_network,10652,,,,53.0671376,-2.5221184,collective,"Transition Group, Community Growing, Other food projects, Nature, Community hub or activities, Festivals, fairs or events, Art / creativity, Community visioning / imagination work, Building local networks, Local economy or new economy projects, Wellbeing or Inner Transition, Youth or education projects, Share, Repair or reuse, Energy, Transport, Other",3,https://maps.transitionnetwork.org/group/sustainable-nantwich/,,
904030,Sustainable St Albans,,England: London &amp; SE | England: Midlands | United Kingdom,Herts,St Albans,,,"Sustainable St Albans is an environmental charity working to help the city and district of St Albans (""the District"") to become a more environmentally sustainable place, in response to the climate and ecological crises that we face. Sustainable St Albans raises awareness of these issues across the District, provides organisations and residents with information about the climate actions that they can take, and runs practical carbon-cutting projects.",https://sustainablestalbans.org/,,,energy_digital,,,transition_network,626,,,,51.7492956,-0.3422526,collective,"Transition Group, Festivals, fairs or events, Community visioning / imagination work, Building local networks, Share, Repair or reuse, Energy, Other",2,https://maps.transitionnetwork.org/group/sustainable-st-albans/,,
904058,Sustainable Tiverton,,England: South West | United Kingdom,DEV,Tiverton,,,"Sustainable Tiverton (formerly Sustainable Villages, and TACT) started in 2008 in the village of Sampford Peverell, but it quickly involved people in the villages of Halberton, Uplowman, Holcombe Rogus, Hockworthy and Burlescombe, Huntsham and Clayhanger. At first all our efforts were aimed at raising awareness in our communities about global warming and peak oil. We showed films, hosted talks.. and mounted exhibitions… We now have many citizen action groups under the umbrella of the organisation which include the Tiverton Repair Cafe, Community Beekeeping, the Tiverton Tree Team, and the Re-Rooted cafe and Community Fridge, Share Shop Tiverton and Home Energy Awareness Team. We run regular a Give & Take event in Tiverton to encourage sharing resources recycling and re-using. People now feel the need to learn new skills. Tree pruning, tool sharpening, bicycle maintainance, knitting and patchwork, permaculture and cider making were all popular. Other activities have been, the establishment of allotments, an annual apple juicing event and equipment to lend to local groups and individuals for juicing, and fruit tree planting in public places. Please join us with your ideas and enthusiasm to create a truly sustainable future. For current events and projects please email info@sustainabletiverton.org.uk, or visit our website http://www.sustainabletiverton.org.uk/ where you can sign up for our regular newsletter of current activities and events.",http://www.sustainabletiverton.org.uk/,,,,,,transition_network,590,,,,50.9071464,-3.4806061,collective,Transition Group,6,https://maps.transitionnetwork.org/group/tiverton-area-communities-transition/,,
904084,Sustainable Tring,,England: Midlands | United Kingdom,Please select a state,Tring,,,"Sustainable Tring is a community-led group of volunteers that exists to strengthen the local economy, reduce our environmental impact, and build our resilience for a future with less cheap energy and a changing climate.​ We are the world's fifty-first transition town where communities get together and take the first steps from a wasteful, oil dependent consumer society to a safer, more responsible and happier one.",https://www.sustainabletring.org.uk/,,,food,,,transition_network,540,,,,51.793541,-0.662625,collective,"Transition Group, Community Growing, Festivals, fairs or events, Art / creativity, Building local networks, Share, Repair or reuse, Energy",4,https://maps.transitionnetwork.org/group/tring-in-transition/,,
903799,Sustainable Wantage,,England: Midlands | United Kingdom,Oxon,Wantage,,,"We are a Community Action Group working to benefit the community by encouraging, promoting and facilitating sustainability in Wantage, Grove and surrounding villages. We run projects and activities on a range of themes, predominantly from our hub The Mix Community Space, which has a Community Fridge, Library of Things, Refill station, monthly Repair Cafes, and a variety of workshops and courses. Additionally we run Wantage Community Larder, we manage Pewit Woodland, Top Lock Meadow, and we are part of a partnership looking after Wantage Market Garden Project with Style Acre and Oxfordshire County Council. We also have a Wild Wantage project which works with local volunteers, schools and community groups with the aim of improving outdoor spaces, for the enjoyment of local residents and to increase opportunities for biodiversity.",http://www.sustainablewantage.org.uk,,,food,,,transition_network,1047,,,,51.5903397,-1.4311454,collective,"Transition Group, Community Growing, Other food projects, Nature, Community hub or activities, Building local networks, Share, Repair or reuse, Energy, Transport",3,https://maps.transitionnetwork.org/group/sustainable-wantage/,,
903972,TT Reading,,England: Midlands | United Kingdom,Berkshire,Reading,,,"Transition Town Reading is a community voluntary organisation that aims to create positive change through reducing environmental impact and dependence on oil. We run a range of community projects in Reading and the Greater Reading area that cover the key areas of Food, Energy and Waste. We are a completely voluntary organisation and rely on donations and grants to run our projects.",https://transitiontownreading.wordpress.com/,,,food,,,transition_network,755,,,,51.455041,-0.969088,collective,"Transition Group, Community Growing, Other food projects, Nature, Community hub or activities, Festivals, fairs or events, Art / creativity, Building local networks, Share, Repair or reuse, Energy, Transport",4,https://maps.transitionnetwork.org/group/tt-reading/,,
903399,Tandem Collective,,England: Midlands | United Kingdom,,Oxford,,,Tandem Collective’s mission is to influence positive change towards environmental sustainability through arts and creativity.,http://tandemcollective.org/,,,,,,transition_network,6273,,,,51.7520131,-1.2578499,collective,Transition Group,5,https://maps.transitionnetwork.org/group/tandem-collective/,,
904072,Taunton,,England: South West | United Kingdom,SOM,Taunton,,,"Taunton Transition Town is a group of individuals from the community working together to meet the challenge of Climate Change. Taunton became an official Transition Initiative in August 2008 and has links with our neighbouring Transition communities in Somerset and beyond, and with Taunton Deane and Somerset County Councils. TTT aims to increase awareness and bring people together to work within the community to facilitate change in key areas of life such as transport, housing, energy use, health, food production and work. Our activities have reduced in recent times and our main project is the Taunton Repair Cafe. We meet approximately every 3-6 months. Please email us if you would like to be involved. You will be very welcome.",http://tauntontransition.wordpress.com/,,,ecology,,,transition_network,574,,,,51.0150236,-3.0960202,collective,"Transition Group, Share, Repair or reuse",6,https://maps.transitionnetwork.org/group/taunton/,,
903297,Tenby Connects,,United Kingdom | Wales &amp; Borders,Pembs,Tenby,,,"Tenby Connects began with the aim of starting a community fridge and edible community garden. It has done this, and the Plastic Free Tenby group has also joined Tenby Connects. There are other additions such as Poetry in the Park and the Tenby food hub, and the group are keen to expand into other areas. Recently we have started a repair cafe, and are aiming to expand the community fridge by having a satellite in the local comprehensive school. We are starting to rebrand the repair cafe day as Sustainable Saturday and continue to broaden our activities.",https://tenbyconnects.co.uk,,,food,,,transition_network,7412,,,,51.6742584,-4.704895,collective,"Transition Group, Community Growing, Festivals, fairs or events, Building local networks, Wellbeing or Inner Transition, Share, Repair or reuse",6,https://maps.transitionnetwork.org/group/tenby-connects/,,
903483,Terra Alta Permaculture Education &amp; Research Centre,,,,,,,"Terra Alta is an off-the-grid Permaculture education and research centre committed to regenerating the soil, producing healthy food, building ecologically, and living sustainably while actively contributing to the international web of eco-cultural transformation. Terra Alta offers experiential life-education programs for people from all walks of life, both youths and adults from all around the world, where, through actively engaging in designing the land during Permaculture Design Courses (PDCs), they become regenerative agents, creating new ways for the future, inciting an international movement of cultural, land, and social transformation.",https://www.terralta.org,,,,,,transition_network,5985,,,,38.7860953,-9.4760796,collective,Transition Group,8,https://maps.transitionnetwork.org/group/terra-alta-permaculture-education-research-centre/,,
903381,The Children's Allotment,,England: Midlands | United Kingdom,,,,,"Our story started in 2017 when we discovered a dilapidated plant nursery next to an allotment site off Cricket Road in Oxford. It was disused for 10 years and was overgrown with brambles. But there was something magical about the place and with a cabin, polytunnel frames, an orchard and growing areas, we saw there was huge potential to unlock . A group a parents, community members and educators formed a Cooperative and set about to transform it into a beautiful outdoor educational space for families to connect with nature. We offer community education activities from our site, for children and up, with a focus on Forest School, food-growing, outdoor play and self-directed learning . The space is also a welcoming local resource , a place where local families can spend time with their children, attend workshops, meet other parents and build social networks. Alongside regular childcare, we will offer community activities and seasonal events .",https://www.thechildrensallotment.org/,,,food,,,transition_network,6356,,,,51.7394901,-1.2272608,collective,"Transition Group, Community Growing, Other food projects, Nature, Community hub or activities, Festivals, fairs or events, Community visioning / imagination work, Building local networks, Youth or education projects",6,https://maps.transitionnetwork.org/group/the-childrens-allotment/,,
903289,The Climate Kitchen Dumfries,,Scotland,Dumfries and Galloway,Dumfries,,,"The Climate Kitchen Dumfries is run by local community members, is a group for learning, sharing, contributing and working together to do something positive for the climate and our town! Gatherings happen the third Friday of each month at The Stove Cafe, where a sustainable sourced meal is provided at the start of the event for all attendees. In every session a different topic is covered and some guest speakers are invited, but our most important guests are the people that wants to make of Dumfries a sustainable and climate responsive town.",https://climatekitchen.co.uk/,,,democracy,,,transition_network,7378,,,,55.0694076,-3.6114864,collective,"Transition Group, Community hub or activities, Festivals, fairs or events, Community visioning / imagination work, Building local networks, Local economy or new economy projects, Share, Repair or reuse",2,https://maps.transitionnetwork.org/group/the-climate-kitchen-dumfries/,,
903393,"The Living Projects, Pondfield",,England: South West | United Kingdom,"Totnes, South Hams",Dartington,,,"The Living Projects at Pondfield is a thriving community-led space that facilitates pioneering initiatives coming from our local area to tackle systemic issues around purposeful work, social infrastructure, rural youth opportunities and nature connection. Founded in 2014 by local young people who wanted to see more opportunities for their generation, Pondfield has grown into a thriving hub for our community. We grow food, we explore pioneering techniques to help ecosystems and biodiversity through regenerative land management. We offer space for volunteering and learning about various horticulture approaches whilst we continue to support the local community through providing opportunities for connection to the land, social health and true wellbeing.",https://www.thelivingprojects.com,,,food,,,transition_network,6360,,,,50.4421465,-3.7193227,collective,"Transition Group, Community Growing, Other food projects, Nature, Community hub or activities, Festivals, fairs or events, Art / creativity, Community visioning / imagination work, Building local networks, Local economy or new economy projects, Wellbeing or Inner Transition, Social Justice / Just Transition activities, Youth or education projects",6,https://maps.transitionnetwork.org/group/the-living-projects-pondfield/,,
904038,Tooting,,England: London &amp; SE | United Kingdom,LND,London,,,"Transition Town Tooting (TTT) is a local community group in south-west London that aims to make change in how we live, where we live in light of climate change. We do this by running projects of all kinds that fit with living more sustainably engaging with our local community, facilitating change and partnering with other groups. For the latest information see our website at www.transitiontooting.org",https://www.transitiontooting.org/,,,food,,,transition_network,646,,,,51.4315913,-0.1645374,collective,"Transition Group, Community Growing, Nature, Festivals, fairs or events, Art / creativity, Community visioning / imagination work, Building local networks, Share, Repair or reuse, Transport",2,https://maps.transitionnetwork.org/group/tooting/,,
903908,Transition Belper CIC,,England: The North | United Kingdom,DBY,Belper,,,"Transition Belper are a group of local people who, as part of the wider Transition Network movement, are exploring how to re-imagine and rebuild our world at this unprecedented time of global crisis. Founded in 2009, Transition Belper is made up of people from all ages and backgrounds. What brings us together is a shared desire for action for the benefit of our local community and our planet. Our activities are aimed at making the market town of Belper a more sustainable place for us all to live, work and play, and at the same time reducing our impact on the planet and our individual and community carbon footprint. Our members deliver a number of projects and groups in Belper including: Inner Transition, our monthly Green Exchange, the Repair Café, a Travel and Transport group, conservation work in Belper Parks, Alton Manor Open Spaces conservation work, Acorn Rec conservation work and we have greened the verges at the Belper railway station. We support a monthly evening community meal - 3rd Friday Feast (3FF), which is vegan and pay as you feel - with profits going to a different charity each month. We support the Welcome Meal - a monthly lunchtime meal - open to all and pay as you feel. We have an Energy Group with a thermal imaging camera and solar powered trailer; who visit homes to give free energy advice. We have teamed up with the local cinema to bring a range of Eco-based films to the community. We also publish a monthly newsletter. Check out our website for more d...",https://www.transitionbelper.org/,,,energy_digital,,,transition_network,851,,,,53.0279309,-1.4841558,collective,"Transition Group, Community hub or activities, Festivals, fairs or events, Building local networks, Wellbeing or Inner Transition, Share, Repair or reuse, Energy, Transport",3,https://maps.transitionnetwork.org/group/belper-transition/,,
903610,Transition Bewdley,,England: Midlands | United Kingdom,Worcestershire,Bewdley,,,"A small group that has in the past run Energy, Food and Land groups. Currently run: A monthly Repair Café (third Saturday of each month in St. Georges Hall). Founder members and prime movers of Wyre Forest Green Alliance which now has over 50 member organisations and a combined membership of 7,000 plus. WFGA runs annual Sustainability Festivals across the district, organises regular Greener Fairs, workshops, and meets regularly with District Councillors and elected members. As well as being closely involved with all the WFGA initiatives and organising most of them, Transition Bewdley also runs: Green Drinks evening once a month. Transformers group, upcycling materials into useful and or artistic items CARP (Communities Against River Pollution) in partnership with local Friends of the Earth and others, testing pollution levels in the River Severn. River Energy District heating scheme which has received funding for phase 1 feasibility and is about to apply for phase 2 feasibility and realisation funding. The scheme has potential for providing all the heat energy for all commercial and domestic premises in Bewdley by 2030. Recently commissioned a Sustainable Transport Report and are looking for opportunities to implement. We initiated Plastic Free Bewdley which we are looking to revive following a pause during and following covid.",https://maps.transitionnetwork.org/group/transition-bewdley/,,,energy_digital,,,transition_network,1417,,,,52.3742892,-2.3149394,collective,"Transition Group, Community hub or activities, Festivals, fairs or events, Building local networks, Share, Repair or reuse, Energy, Transport",2,https://maps.transitionnetwork.org/group/transition-bewdley/,,
904006,Transition Black Isle,,Scotland | United Kingdom,HLD,,,,"Transition Black Isle is about helping Black Isle communities thrive in the face of Climate Change. We run community markets, we support local food and drink producers, we help people grow more food, we encourage non-car travel, support energy saving and promote reduction of single use plastics - and much more. If we in the Black Isle work together to manage more of our own resources, we can thrive despite whatever climate change and the end of fossil fuels throws our way. All of us will be affected, all of us can do something for our lives and our children's lives. How can we help each other? We set up in 2009 and now we: operate three (and support one) community market; support an Electric Bike Hire social enterprise; run practical courses in food growing; run an annual potato day and apple pressing days; created and support a local larder website https://blackislelarder.org/ showing all the local food growers, sellers, cafes, restaurants etc; produce Active Travel Maps for the Black Isle , have updated safe cycling & walking route maps; promote &#8216;slow tourism'; and are engaged in many local and Community Networks. Recent additions to our activities include participating with five other Highland groups in a five year lottery-funded home energy information and advice project; supporting monthly Repair Cafes in conjunction with Black Isle Men's Shed, and setting up a Black Isle &#8216;Library of Things', lending out tools, household and leisure equipment from leased p...",http://www.transitionblackisle.org,,,food,,,transition_network,680,,,,57.6076586,-4.334085,collective,"Transition Group, Community Growing, Other food projects, Community hub or activities, Festivals, fairs or events, Share, Repair or reuse, Energy, Transport",4,https://maps.transitionnetwork.org/group/black-isle/,,
