id,name,country_code,country_name,state_province,city,registration_id,registration_type,description,website,email,phone,framework_area,ntee_code,icnpo_code,source,source_id,last_filing_year,annual_revenue,employee_count,lat,lon,model_type,tags,alignment_score,evidence_url,evidence_quote,last_verified_at
903953,Walthamstow,GB,United Kingdom,London,London,,,"Our group’s purpose is ‘a happy, healthy Walthamstow, where through working together as a community we can reduce our energy use and increase our resilience’. In Walthamstow we aim to support local organisations that encourage the development of more resilient communities, help local people gain low carbon and low energy living skills, reduce their living costs, and enjoy the benefits of better connectedness with their community, and run projects which demonstrate the potential for Walthamstow to reduce its planetary impact. We meet at 7.30pm on the second Monday of each month at Ye Olde Rose & Crown pub, 53 Hoe Street, Walthamstow, E17 4SA.",http://transitionwalthamstow.org.uk,,,food,,,transition_network,763,,,,51.5877497,-0.0206262,collective,"Transition Group, Community Growing, Building local networks",3,https://maps.transitionnetwork.org/group/walthamstow/,,
903568,Association Vestigium,HR,Croatia,,Zagreb,,,"We run Community center Vrbani in suburban area of Zagreb, since 2013., and Cooperative community center Brezovica in rural area of Zagreb, since 2022. We help new initiatives to start in city of Zagreb, but also inspire many regional initiatives. Vestigium responds to the need of the community through its members and users… Vestigium Association (lat. footprint) is an ecological-creative association for improving the quality of our community by approaching and promoting a healthy and sustainable way for our future. The idea of founding the association arose in 2011 by six women listening to the needs of their neighbours in creating a multifunctional space where initiatives could take place and develop. The space given by Vestigium should improve the quality of living together as a community and to solve problems such as the growing distance among people, the lack of places to gather and to socialize, the lack of content for children and adults in their lives and the exclusion of families and their children as well older residents. ​ …to give people a space and a platform to help shape their community creatively and freely… The Vrbana area is a typical young district of Zagreb with many residents being families. Services such as a market, a library, a health center and a community center have long been missing. Vestigium provides some of these by holding a farmers market, creating a free library, having poetry evenings, arranging storytelling sessions for the youngest and ...",http://udrugavestigium.wixsite.com/vestigium,,,food,,,transition_network,1642,,,,45.7937987,15.9181314,collective,"Transition Group, Community Growing, Other food projects, Nature, Community hub or activities, Festivals, fairs or events, Art / creativity, Community visioning / imagination work, Building local networks, Local economy or new economy projects, Wellbeing or Inner Transition, Social Justice / Just Transition activities, Youth or education projects, Share, Repair or reuse",6,https://maps.transitionnetwork.org/group/association-vestigium/,,
903548,Eko Centar Latinovac,HR,Croatia,34350,Latinovac,,,The primary mission of Eco centre Latinovac is to promote and educate in: • Community building • Sustainable and renewable environmental practices • Reviving and preserving cultural traditions and heritage,http://ekocentarlatinovac.hr,,,food,,,transition_network,1651,,,,45.3483451,17.9556942,collective,"Transition Group, Community Growing, Nature, Festivals, fairs or events, Art / creativity, Building local networks, Local economy or new economy projects, Youth or education projects",2,https://maps.transitionnetwork.org/group/eko-centar-latinovac/,,
903314,Perforum,HR,Croatia,,Rijeka,,,"Od 2012. godine, Perforum funkcionira kao komunikacijska platforma za povezivanje ljudi s interesom za permakulturu, regenerativnu poljoprivredu, uradi-sam vještine, obnovljive izvore energije, zaštitu prirode i bliskih područja. To je neprofitan projekt koji omogućava da ljudi dijele svoje znanje i informacije sa zajednicom. Koristimo zajednički jezik koji se koristi u državama (abecednim redom): Bosna i Hercegovina, Crna Gora, Hrvatska i Srbija. Trenutno se možemo pohvaliti sa 8,000 redovitih čitatelja mjesečno na našoj osnovnoj platformi www.perforum.info. U prosjeku, objavljujemo 20 članaka mjesečno, pisanih rukom članova naše zajednice. Također, održavamo Facebook stranicu i grupu sa preko 10.800 pratitelja. Perforum vodi međunarnodna mreža za razvoj permakulture na Balkanu Zemljanke 2.0. Samoorganizirani smo prema principima Sociokracije 3.0. &#8212; Since 2012, Perforum is known as a communication platform that connects people interested in permaculture, regenerative agriculture, DIY skills, renewable energy, preservation of environment and related topics. It is a non-profit project that allows people with extra knowledge or information to share it with community. It operates in common language spoken in (alphabetically) Bosnia and Herzegovina, Croatia, Montenegro and Serbia. Nowadays, we are proud to have around 8,000 monthly readers on our main platform www.perforum.info. We publish at average 20 articles each month, written by members of our community. We also ru...",https://www.perforum.info,,,ecology,,,transition_network,7324,,,,45.3271752,14.4412309,collective,"Transition Group, Nature",10,https://maps.transitionnetwork.org/group/perforum/,,
903357,TIR,HR,Croatia,,Rijeka,,,"TRANZICIJSKA INICIJATIVA RIJEKA - TIR je neformalna grupa građana osnovana početkom 2018. godine. Nastala je kao potreba nekolicine članova Grupa solidarne razmjene (GSR) šireg riječkog područja da se priključe globalnom tranzicijskom društvenom pokretu u kojem se okupljaju pojedinci kako bi zajedno gradili male održive zajednice otporne na ekološke, klimatske i ekonomske izazove s kojima se svakodnevno suočavamo. Naši dosadašnji projekti po kojima smo prepoznati u Rijeci su ""Revija zelenog filma"", ""Jestivi grad"", ""Festival održivosti"" a za 2021. predlažemo akciju ""Kompostiraj, bicikliraj i vrt aktiviraj""&#8230; TRANSITION INITIATIVE RIJEKA - TIR is an informal group of citizens founded at the beginning of 2018. It was created as a need of several members of the Community supported agriculture (CSA) of the wider Rijeka area to join the global transitional social movement in which individuals gather to build small sustainable communities resistant to environmental, climate and economic challenges we face every day. Our previous projects by which we are recognized in Rijeka are ""Green Film Review"", ""Edible City"", ""Sustainability Festival"" and for 2021 we propose the action ""Compost, bike and activate the garden""&#8230;",https://maps.transitionnetwork.org/group/tir/,,,,,,transition_network,6550,,,,45.3271752,14.4412309,collective,Transition Group,5,https://maps.transitionnetwork.org/group/tir/,,
903870,Átalakuló Wekerle - Transition Wekerle,HU,Hungary,PE,Budapest,,,"Below, you can find an account of Transition Wekerle 1:0, but where is this community initiative today? UPDATE 2025: Started in 2008 in the suburbs of Budapest, in the 100 year old Garden City Movement estate called Wekerle, this was an intentional pioneer project to inject confidence into the at then unusual concept of a local community organising itself in light of the growing climate crisis. Today, after suffering what has been described as the &#8216;Doughnut Effect'; loss of key members through migration and to paid jobs in big NGOs; silly interpersonal conflicts; vastly fluctuating capacity; becoming councillors and council committee members; working with, against, and in spite of the local council; working with a miriad of local and international entities on climate education; initiating a ( so far ) amazingly successful campaign opposing major woodland destruction for road building; loosing another amazingly conflictual campaign on local school catering and (alledged) corruption; organising culturally innovative participatory processes on farmer's market development, green space, national and local elections, and the woodland's future&#8230;.And of course providing the ""inspirational example and initiating capacity"" for the Catalyst Communities Network, a 5 year long, funded cooperation between 25 local Roma, ecovillage and urban subcultural projects which almost resulted in a functional Transition HUB but didn't quite make it&#8230; And now? This has all culminate...",http://www.atalakulowekerle.blogspot.hu,,,,,,transition_network,943,,,,47.49585,19.060185,collective,Transition Group,7,https://maps.transitionnetwork.org/group/atalakulo-wekerle-transition-wekerle/,,
903117,Transition Ubud in Bali,ID,Indonesia,Bali,Ubud,,,"A small group of regen enthusiasts in Bali in and around Ubud are exploring how to team up to help foster a more regenerative way of life and travel on the island. Our focus is on gathering social enterprises, regenerative resorts, organic, vegetarian friendly restaurants, eco tours, organic farms, makers of sustainable products, service providers related to the regenerative movement, community center stewards, eco villages, technologists and blockhain enthusiasts, conservationists, artists, musicians, change makers and community leaders together to explore synergies and build a more resilient, intentional network. While the movement may begin in Ubud and the surrounding areas, we are very open to working with others across Bali, most notably in Denpasar, Sanur, Canggu, and &#8216;the bukit.'",https://maps.transitionnetwork.org/group/transition-ubud-in-bali/,,,food,,,transition_network,16398,,,,-8.507156,115.2617848,collective,"Transition Group, Community Growing, Other food projects, Nature, Community hub or activities, Building local networks, Local economy or new economy projects",2,https://maps.transitionnetwork.org/group/transition-ubud-in-bali/,,
903448,ClimateSmart Cloughmills,IE,Ireland,COUNTY ANTRIM,Cloughmills,,,"ClimateSmart Cloughmills builds on over 20 years of environmental action by Cloughmills Community Action Team. This new campaign group, inspired by those who have driven environmental action in Cloughmills, draws together all the climate related action we have undertaken. We want to demonstrate that a transition to a climate just community presents opportunities for rather than denying or restricting a better quality of life. We manage a series of activities and programmes under the headings of: Natural environment Energy/resource use Food Active travel Waste",https://maps.transitionnetwork.org/group/climatesmart-cloughmills/,,,food,,,transition_network,6170,,,,54.997312,-6.3301849,collective,"Transition Group, Community Growing, Other food projects, Nature, Community hub or activities, Community visioning / imagination work, Building local networks, Local economy or new economy projects, Wellbeing or Inner Transition, Share, Repair or reuse, Energy",5,https://maps.transitionnetwork.org/group/climatesmart-cloughmills/,,
903808,Galway,IE,Ireland,GW,,,,"Transition Galway/Trasdul na Gaillimhe is a local voluntary grassroots environmental organisation and is one of thousands of Transition projects around the world. Our aim is to build strong resilient communities and a vibrant local economy to deal with sustainability challenges such as reduced oil supplies and climate change. Founded in January 2011, Transition Galway has been very active and organise local events such as Green Drinks Galway (a regular free talk with guest environmental speakers), community film screenings and workshops. We also run a community garden at a local city-centre primary school (Scoil Chroí Íosa on the Newcastle Road) and we collaborate in projects with other local environmental groups.",http://transitiongalway.wordpress.com/,,,,,,transition_network,1027,,,,53.273797,-9.05178,collective,Transition Group,7,https://maps.transitionnetwork.org/group/galway/,,
904080,Holywood,IE,Ireland,BFS,Holywood,,,"2022, we carried out a community public consultation exercise to address achieving our climate change goals by changing our food systems; balancing the need for sustainability with food affordability and fair pay for farmers. We aim to grow a local food network that is good for people and planet built around local, healthy, seasonal and affordable food starting with Holywood CoFarm at Kerr Park.",https://maps.transitionnetwork.org/group/holywood/,,,food,,,transition_network,536,,,,54.642435,-5.829995,collective,"Transition Group, Community Growing, Other food projects",4,https://maps.transitionnetwork.org/group/holywood/,,
904091,Kinsale,IE,Ireland,CK,Kinsale,,,"Transition Town Kinsale is a voluntary community initiative working to help make the transition from a dependency on fossil fuel to a low carbon future. Our Vision is a resilient, self-reliant and sustainable Town. What began in Kinsale in 2005 has now become a global movement. Rob Hopkins, teacher of Permaculture at Kinsale Further Education College, produced the groundbreaking Kinsale Energy Descent Action Plan with his students, exploring ways in which the community could prepare for Peak Oil. One of his students, Louise Rooney, set about developing the Transition Towns concept resulting in the historic decision by Kinsale Town Council to adopt the plan. Rob moved to the UK where he established the second Transition Town in Totnes which has become an inspiring focal point of the movement. 2005 Kinsale Energy Descent Action Plan",http://www.transitiontownkinsale.org/,,,,,,transition_network,503,,,,,,collective,Transition Group,7,https://maps.transitionnetwork.org/group/kinsale/,,
903176,SMARTlab Creative Technology Innovation,IE,Ireland,Dublin,Dublin,,,"SMARTlab is a dedicated interdisciplinary group of activists, practitioners and scholars from across disciplines and from all over the world, working together to support people and the planet. Sustainability, women's and children's safety and rights, the rights of persons with disabilities and neurodiversities, elderly citizens and indigenous groups are among our communities of collaboration. We employ a bespoke Inclusive Design method of co-creation in all our work. We welcome collaboration and offer training and a practice-based PhD for practitioners.",https://www.smartlab.academy,,,democracy,,,transition_network,11642,,,,53.0676266,-6.2402344,collective,"Transition Group, Community hub or activities, Festivals, fairs or events, Art / creativity, Community visioning / imagination work, Social Justice / Just Transition activities, Youth or education projects, Other",5,https://maps.transitionnetwork.org/group/smartlab-creative-technology-innovation/,,
903308,Sustainable Greystones,IE,Ireland,,Greystones,,,"“Sustainable Greystones - A Transition Town Initiative” We are a group of Greystones residents, with varying backgrounds and needs but what we all have in common is a wish to take action to address climate change and the effects of biodiversity loss. Greystones has immense potential in the community. Our aim is to bring people together at a local level to imagine and create a better and happier environment where people feel more empowered, develop a greater sense of purpose through engagement and participation. Our mission is to build a sustainable future for Greystones by addressing climate change through community engagement, inclusive participation, and locally driven solutions. We are hoping to achieve our mission by strengthening a sense of community and increasing participation at a local level.",https://sustainablegreysto.wixsite.com/sustainable-greyston,,,,,,transition_network,7346,,,,53.1448901,-6.0632184,collective,Transition Group,3,https://maps.transitionnetwork.org/group/sustainable-greystones/,,
903594,Transition Kerry,IE,Ireland,,,,,"Our objective is to accelerate change through inspiring, encouraging, supporting, networking and training our communities as they consider and then implement their vision for the future they want to live in. Like the rest of Ireland. Kerry, Tralee its other towns villages and communities are dependent on sources outside of the country for most of our food, fuel, energy, a lot of our jobs, and most of our “stuff”. We need to become a more self-reliant and sustainable community. The toughest challenges facing Tralee, our communities and humanity itself at the start of this 21st century are Climate Change, Peak Oil, food shortages and Economic decline. Climate Change is well documented while true and effective changes are slow manifesting. Peak Oil, however, remains under the radar for most people. Peak Oil, which is heralding the era of ever declining fossil fuel availability, will challenge even further or perhaps bring an end to the economic and social stability that is essential if we are to mitigate the threats posed by Climate Change. The transition initiatives represent the most promising way of engaging people and communities to take the far-reaching actions that are required to mitigate the effects of Peak Oil and Climate Change. These re-localisation efforts will result in a life that is more fulfilling, more socially connected and more equitable.",http://www.transitionkerry.org,,,,,,transition_network,1557,,,,52.1454065,-9.5174689,collective,Transition Group,4,https://maps.transitionnetwork.org/group/transition-kerry/,,
903577,Transition Town Corca Dhuibhne,IE,Ireland,Kerry,Ceann Trá - Baile an Fheirtéaraigh - Dingle,,,"We are a community environmental and sustainability voluntary group. Our aims are to enable our community to be more sustainable, to develop resilience and to promote self reliance. We work on projects that concern waste, energy, resource use, food & water and transport; and span themes such as the natural and living environment, quality of life and community well being. Our objectives are to build capacity with a view to providing our needs from local resources and to promote engagement with issues that effect us now and in the future. We strive to achieve our objectives through collaborative work & learning, resource & information sharing and community involvement. Examples of our activities include initiatives (making the Dingle Food Festival waste-free), community events (repair café) and projects (Plastic free dingle). We also run training (for example tree planting and orchard growing), awareness raising and outreach programmes and liaise with the local authority and other local groups. We are open to more people to be involved, either to assist on initiatives and work projects and/or to contribute in organizational role, in whatever way suits. We are registered with the Kerry Public Participation Network. The Kerry PPN is the main link through which the Local Authority connects with the Environmental, Social Inclusion, Community and Voluntary Organizations and allows community participation in policy-making structures and committees of Council.",https://maps.transitionnetwork.org/group/transition-town-corca-dhuibhne/,,,food,,,transition_network,1561,,,,52.2067924,-10.09711,collective,"Transition Group, Community Growing, Other food projects, Nature, Community hub or activities, Festivals, fairs or events, Art / creativity, Community visioning / imagination work, Building local networks, Youth or education projects, Share, Repair or reuse",4,https://maps.transitionnetwork.org/group/transition-town-corca-dhuibhne/,,
903551,Transition Town Kinsale,IE,Ireland,Cork,Kinsale,,,"Transition Town Kinsale is a voluntary community initiative working to help make the transition from a dependency on fossil fuel to a low carbon future. Our Vision is a resilient, self-reliant and sustainable Town. What began in Kinsale in 2005 has now become a global movement. Rob Hopkins, teacher of Permaculture at Kinsale Further Education College, produced the groundbreaking Kinsale Energy Descent Action Plan with his students, exploring ways in which the community could prepare for Peak Oil. One of his students, Louise Rooney, set about developing the Transition Towns concept resulting in the historic decision by Kinsale Town Council to adopt the plan. Rob moved to the UK where he established the second Transition Town in Totnes which has become an inspiring focal point of the movement.",http://www.transitiontownkinsale.org,,,food,,,transition_network,1700,,,,51.705737,-8.5229823,collective,"Transition Group, Other food projects, Nature, Festivals, fairs or events, Building local networks, Share, Repair or reuse, Energy",7,https://maps.transitionnetwork.org/group/transition-town-kinsale/,,
903896,Transition Wicklow,IE,Ireland,Wicklow,Glenealy,,,"Beginning in 2010 as WOW (Wicklow and Our World) a small temporary initiating steering group ran Transition events and trainings over a period of a few years. This work help initiate a number of local activities, projects and programmes which are listed on a page on the website of a permaculture placed based learning site in County Wicklow: wicklow-sustainable-living-network Individuals from this network continue to engage with other Transition work and aligned networks such as permaculture, sociocracy, regenerative economy, arts and ecology and other related land restoration and social permaculture groups. We are also always interested in connecting with others around the world to inform local practice. Please reach out to us via our websites and socials.",http://dulra.org/wicklow-transition,,,food,,,transition_network,872,,,,52.9727836,-6.1873798,collective,"Transition Group, Community Growing, Other food projects, Nature, Community hub or activities, Festivals, fairs or events, Art / creativity, Community visioning / imagination work, Building local networks, Wellbeing or Inner Transition, Youth or education projects, Share, Repair or reuse",6,https://maps.transitionnetwork.org/group/transition-wicklow/,,
903447,Auroville Bioregion Food System,IN,India,,,,,"Dreaming of a local Food System we see…. A food culture deeply connected to the natural world: the local soil, water and biodiversity. Knowledge about local, natural food and recipes is maintained, celebrated, and evolving. Awareness about local and seasonal food is raised through workshops, education, farm visits, citizen forums, performing arts, and increased exposure in restaurants and canteens. Education is not just through books and the mind, but involves all the senses: touch, taste, smell, hearing and sight. People are cooking that which is abundant around us, (re-)discovering indigenous plants and herbs, as well as species of fish. Health improves due to reduction of toxins, improved nutrition, increased diversity and more attention being paid to what we put in our mouths. Young people get involved in farming, processing and preparing natural foods. Entrepreneurs building businesses to serve the local food economy, growing into healthy companies, sustaining livelihoods of farmers, fisherfolk, staff, managers and technicians. Fair trade that do not exploit suppliers nor buyers, in fact a sense of shared purpose helps us overcome our polarised positions and build solidarity. Common commercial practices include advance bookings, risk sharing (eg. from weather / emergency) Organic food is no longer a niche product, but the norm. Chemical food is an exception. Agriculture extension services focus on ecological approaches. Application of technology to make operations run...",https://maps.transitionnetwork.org/group/pondy-food-system/,,,food,,,transition_network,6179,,,,11.9340568,79.8306447,collective,"Transition Group, Community Growing, Other food projects, Nature, Community hub or activities, Festivals, fairs or events, Art / creativity, Community visioning / imagination work, Building local networks, Local economy or new economy projects, Wellbeing or Inner Transition, Social Justice / Just Transition activities, Youth or education projects",9,https://maps.transitionnetwork.org/group/pondy-food-system/,,
903678,Biellese in Transizione,IT,Italy,BI,,,,"""Biellese in Transizione"" is a local hub covering the whole province of Biella. Active since 2012. So far 3 local initiatives offsprings. Various working groups: tourism, reconomy, cohousing, education, local money.",http://bielleseintransizione.wordpress.com/,,,,,,transition_network,1293,,,,45.564463,8.104522,collective,Transition Group,2,https://maps.transitionnetwork.org/group/biellese-in-transizione/,,
