id,name,country_code,country_name,state_province,city,registration_id,registration_type,description,website,email,phone,framework_area,ntee_code,icnpo_code,source,source_id,last_filing_year,annual_revenue,employee_count,lat,lon,model_type,tags,alignment_score,evidence_url,evidence_quote,last_verified_at
903662,Building Resilience In Mission (BRIM),CA,Canada,BC,Mission,,,"The City of Mission consists of the small town of Mission and its surrounding rural area about 70 km (45 miles) east of Vancouver, British Columbia, Canada. It is located on the slopes of the north shore of the Fraser River overlooking the Fraser Valley. The rapidly growing community has a current population of about 41,000. In October 2011, the Vancouver-based Be The Change Earth Alliance, in cooperation with the District of Mission Restorative Justice program, presented an Environmental Symposium in Mission. Following the symposium, about 10 people formed an Action Circle to meet for 2 hours every second Saturday afternoon. There are currently 8 members. Initially, the focus was on supporting each other as we worked on individual actions leading to personally and ecologically healthier life-styles. We then expanded our actions into the community with several Transition-like events. In the summer of 2014, the Be The Change Circle decided that its next project would be the creation of a Transition Initiative in Mission. We began in July with 2 awareness-raising events - first a booth at the local Farmers’ Market then 2 weeks later a booth at a street festival. The intention was not to be the Transition Initiative but to be the catalyst in its formation. On March 28, 2015, about 40 citizens attended a public meeting to introduce the Transition concept to Mission. A couple of short videos explained the principals of Transition. Then, a panel of 3 representatives of local Tra...",http://www.wearebrim.ca/,,,energy_digital,,,transition_network,1316,,,,49.1533935,-122.3425448,collective,"Transition Group, Share, Repair or reuse, Energy, Other",7,https://maps.transitionnetwork.org/group/building-resilience-in-mission-brim/,,
903442,Coopérative Système T,CA,Canada,Québec,Chicoutimi,,,"La coopérative Système T vise à accélérer la transition socio-écologique en développant et en accompagnant des projets qui ont un impact positif aux niveaux social, environnemental, culturel et économique.",https://maps.transitionnetwork.org/group/cooperative-systeme-t/,,,,,,transition_network,6220,,,,48.4281021,-71.0640367,collective,Transition Group,4,https://maps.transitionnetwork.org/group/cooperative-systeme-t/,,
903968,Cowichan,CA,Canada,BC,Duncan,,,"Transition Cowichan is a volunteer initiative working to empower our community to build resilience in response to the challenges of global warming and the impacts of accelerating climate change, peak oil, and global economic instability. With a focus on community building, Transition Cowichan hopes to inspire and support ordinary citizens in working collectively to make our Cowichan communities healthy, sustainable places to work, play, and raise future generations. This initiative will ultimately be shaped by all who are able to participate, in whatever way they can. We seek to bring together those in our community who are already working on local resilience and self-sufficiency in food, water, energy and other matters vital to healthy communities. We also seek, new models for community transformation which will help us reach our goal of community resilience and sustainability. Visit us at transitioncowichan.org",transitioncowichan.org,,,,,,transition_network,751,,,,48.777666,-123.709827,collective,Transition Group,5,https://maps.transitionnetwork.org/group/cowichan/,,
903473,EcoTransition,CA,Canada,Québec,Verdun,,,"EcoTransitionMTL promotes and supports innovative projects that help maintain, develop, and strengthen our local environment and communities. We focus on the harmonious coexistence between people and the ecosystems that support them. Our projects foster individual and community self-sufficiency, resilience, and regeneration in food, energy, shelter, and other material and nonmaterial needs in a viable and nourishing way. Our core commitment is to benefit life in all its forms.",https://www.ecotransitionmtl.org/,,,food,,,transition_network,6052,,,,45.505986,-73.5699463,collective,"Transition Group, Community Growing, Other food projects, Nature, Social Justice / Just Transition activities",3,https://maps.transitionnetwork.org/group/ecotransition-mtl/,,
903758,Haliburton in Transition (HinT),CA,Canada,ON,,,,"Since February 2011,we formed a steering committee and have initiated workshops and events: conducted an all day Open Space session conducted workshops and demonstrations on heirloom seed saving, vermicomposting, mushroom culture, preserving and fermenting, wild food, season extending, composting a group seed purchasing and 2 seed exchanges, a group purchase of cold hardy fruit trees and shrubs (44 families) compiling a directory of volunteer and not for profit organizations that we can liase with on issues of transition and resilience communal hoophouse purchases and raising in conjunction with season extending practices a grain CSA has started members are doing alternative building practices",https://maps.transitionnetwork.org/group/haliburton-in-transition-hint/,,,,,,transition_network,1149,,,,45.136644,-78.347503,collective,Transition Group,2,https://maps.transitionnetwork.org/group/haliburton-in-transition-hint/,,
903882,Huronia,CA,Canada,ON,Midland,,,"Transition Town Huronia is a local group working to unite the communities of Midland, Penetanguishene, Tiny, Tay and Christian Island and encourage its residents to make positive and sustainable changes that enhance the transition from oil dependence to local resilience. TTH’s mission is to create a more resilient community is by: Providing education and expanding awareness of peak oil and climate change; Awakening a responsibility for food, transportation, fuel and social networks; Strengthening connections between local organizations, businesses and government; and, Fostering opportunities that engage people to work together with greater harmony and mutual respect. Transition Town Huronia began in February 2010 with its humble beginnings as a Steering Committee composed of 6 people. Today, the group is growing stronger and stronger and continuing to build awareness in the community of nearly 50,000 people.",http://www.tthuronia.ca,,,,,,transition_network,920,,,,44.750433,-79.887206,collective,Transition Group,4,https://maps.transitionnetwork.org/group/huronia/,,
903690,Lantzville Transition Initiative,CA,Canada,BC,Lantzville,,,"Lantzville Transition Village initiative launched 07 Nov.2013 About 20 Lantzville people turned out on October 26 at Pyramid Stables, to explore opportunities for Lantzville to become part of the worldwide Transition Town movement. After a video about Transition actions and philosophy, several short presentations were made about projects which could be easily undertaken: organised sharing of garden surpluses; a butterfly friendly Lantzville; a workshop series on how to use social media; and a personal project involving growing food as therapy for people with depression. Participants were impressed both by the philosophy of just getting together to do projects and with some of the ideas and activities already under way. Comments included wanting to do more in Lantzville, whether shopping, work or leisure activities. All were agreed that Lantzville would benefit from more neighbourly activities and that this would contribute to a growing sense of community. A series of informal meetings has been arranged for Saturdays, Nov. 23, Dec. 14 and Jan. 25 at 2:30 at Riso’s. All are welcome.",https://maps.transitionnetwork.org/group/lantzville-transition-initiative/,,,,,,transition_network,1272,,,,49.250625,-124.074691,collective,Transition Group,3,https://maps.transitionnetwork.org/group/lantzville-transition-initiative/,,
903959,Penetangore Transition Town,CA,Canada,ON,Kincardine,,,"Penetangore Transition Town - Press Release Jun 2011 A Transition Initiative (which could be a town, village, university, island, etc) is a community-led response about visioning what it is possible to do; about being inclusive and creating a community that is in balance with the natural environment and is sustainable despite the pressures of climate change, fossil fuel depletion and increasingly, economic contraction. There are thousands of initiatives around the world starting their journey to answer this crucial question: ""How can our community respond to the challenges and opportunities of peak oil, climate change and economic stagnation?""The members of this group are concerned with this community's ability to live with less energy as a result of inevitable fossil fuel depletion. ""This can be looked at as an opportunity if we plan for it, but a threat if we wait for it to happen to us. Most communities, including ours, currently lack the resilience to withstand some of the disruptions that will accompany climate change. It is necessary for us to work together and work now, rather than waiting for the government or ""someone else"" to take action on our behalf. The transition will have to happen at an inner personal level as well as a community level and by using the energy of a collective group we can proactively design our own energy descent and build ways of living that are more connected, more enriching and that recognize the ecological limits of our biosphere.""At its...",https://maps.transitionnetwork.org/group/penetangore-transition-town/,,,,,,transition_network,775,,,,44.174892,-81.636154,collective,Transition Group,6,https://maps.transitionnetwork.org/group/penetangore-transition-town/,,
903708,ReThink Red Deer,CA,Canada,Alberta,Red Deer,,,"ReThink Red Deer is dedicated to enhancing the long term quality of life in Red Deer and surrounding area. Our philosophy is that we are citizens first and consumers second; that our world is finite and borrowed from future generations; that we can live sustainably and in harmony with nature; and that inspiration is a renewable resource. ReThink Red Deer coordinates its action around four key principles: 1) Smart Urban Planning 2) Protecting and Enhancing Natural Assets 3) Transportation Alternatives 4) Reinvigorating the Democratic Process We believe in starting where we can - with our own lives, and our own community - Red Deer. Our organization assembles around the practices of a ""for-benefit"" organization; integrating social and environmental aims with business approaches. ReThink Red Deer is applying a social enterprise model, selling soil amending products (worm castings and rock dust) as well as microgreens and vegetables grown at our urban homestead and sold at local markets through ""The Root Cellar: ecoStore & Apothecary"". We aim to couple environmental responsibility and community service while using our earned revenue for projects that responsibly inform citizens and contribute to the common good. Check out our working group, ""The Centre for Urban Agriculture in Alberta"" for project pictures and valuable information.",https://www.rethinkreddeer.ca,,,food,,,transition_network,1228,,,,52.275148,-113.844493,collective,"Transition Group, Community Growing, Other food projects, Festivals, fairs or events, Local economy or new economy projects, Social Justice / Just Transition activities, Youth or education projects, Share, Repair or reuse, Energy",3,https://maps.transitionnetwork.org/group/rethink-red-deer/,,
903732,Regenerative Bowen Island (formerly Bowen in Transition),CA,Canada,BC,Bowen Island,,,"Regenerative Bowen Island, formerly called Bowen in Transition, has been in existence since 2010, has been mostly inactive since the pandemic, and now has only two ongoing initiatives, the Fix-It Fair (twice a year) and the Bowen Island Food Resilience program (operating a small regen-ag farm and orchard). Prior to the pandemic, it ran and sponsored many programs such as: • Annual Sustainability Tour / Field Trip • Tree Planting and Permaculture Events • Forward Focus Film Series and Transition Library • Youth in Transition Project • Canning & Preserving Events • Community Currency Project: Bowen Bucks (on hiatus) • Workshops & Games: Resilient Communities, Inner Transition, Meaningful Livelihoods, Sharing Economy • Climate Change/Carbon Footprint Updates • Energy Audits and other Renewable Energy Actions • Liaison with other Transition and Community Groups • Fix-it Fairs • Sharing Circles • The Bowen Green Guide – (currently down to be updated) with resources on Local Food, Transportation, Waste, Water, Local Economy, Gardening & Landscaping, House & Home, Green Consumerism, Resilient Community, Health & Wellness, Arts & Culture Our current Board consists of 4 Directors: Dave Pollard, Jacqueline Massey, Jackie Bradley, and Paola Qualizza.",http://bowenintransition.com/,,,food,,,transition_network,1183,,,,49.350777,-123.39767,collective,"Transition Group, Community Growing, Other food projects, Share, Repair or reuse",10,https://maps.transitionnetwork.org/group/bowen-in-transition/,,
903787,St Margarets Bay (Transition Bay St Margarets),CA,Canada,NS,Upper Tantallon,,,"Transition Bay St Margarets (www.transitionbay.ca) is a suburban town initiative started in January 2011. St Margarets Bay, Nova Scotia, presents a hybrid culture between newer residents who are either retirees or commuters into the Halifax city core, and long-time residents with livelihoods based on tourism, services or resources. The group has grown quickly, initially focused on local food production, transition 4-season gardening, arable land and greenhouse inventory and potential local markets and food distribution. The organization received substantial grant funding in both 2011 and 2012, and has hosted Training for Transition and Permaculture workshops in early 2012 and numerous other events. The Great Unleashing occurred in November 2012 will great success, including a talk by the new Major of Halifax. Transition Bay has launched several projects including a Farmer's Market, local Educational Vegetable Garden, Community Garden and local currency called the &#8216;Carat'. See details on our website. Other projects being explored include biofuels, social-media based forms of transportation networking and reskilling. Transition Bay St Margarets has partnered with the St Margarets Bay Stewardship Association, a highly respected area organization fostering sustainable development in the region, as well as the local public library and other area groups. As we move into 2025, we are celebrating our 14th year of existence, and enjoy deep respoct and appreciation from the lo...",https://www.transitionbay.ca,,,food,,,transition_network,1073,,,,44.6876947,-63.8820648,collective,"Transition Group, Community Growing, Community hub or activities, Festivals, fairs or events, Community visioning / imagination work, Building local networks, Local economy or new economy projects, Wellbeing or Inner Transition, Social Justice / Just Transition activities, Youth or education projects, Share, Repair or reuse, Energy",10,https://maps.transitionnetwork.org/group/st-margarets-bay-transition-bay-st-margarets/,,
903143,The Resilient Urban Systems &amp; Habitat RUSH Initiative whatstherush.ca,CA,Canada,British Columbia,North Saanich,,,"The RUSH Initiative is a cross sectoral collaboration to create rapid resilience in record time by engaging people in creating the conditions for health now, and into the future. Our approach combines nature-inspired design, community mapping and a focus on health with watersheds as a primary indicator. By showcasing the research, creativity, and innovation happening in this region on an interactive landing page, we hope to provide a shared language on the vulnerabilities and opportunities for long-term health and climate action. We want to change the critical questions that get asked in planning meetings such as: How is a development proposal an opportunity to increase resilience to climate-related events? How can we support neighbourhoods to adapt and thrive in changing conditions? If we extend and connect the ecosystem features across the urban landscape, what are all the benefits people would feel? How can we work with Nature to create a quality of life for all? This is a tool for people to connect habitats, restore watersheds, feel a sense of belonging, and start conversations that help us reverse the trend of climate change, pollution and hopelessness. Climate change is a real bummer but reversing the trend is at our fingertips and in our footprints. The Resilient Urban Systems & Habitat (RUSH) Initiative is about rapid resilience in record time. Join this collective creation to mapping the difference we’re all making. Comparing datasets on personal and planetary hea...",https://whatstherush.ca/,,,food,,,transition_network,13727,,,,48.6383538,-123.4341431,collective,"Transition Group, Community Growing, Other food projects, Nature, Community hub or activities, Art / creativity, Community visioning / imagination work, Building local networks, Local economy or new economy projects, Social Justice / Just Transition activities, Youth or education projects, Share, Repair or reuse, Energy, Transport, Other",7,https://maps.transitionnetwork.org/group/the-resilient-urban-systems-habitat-rush-initiative-whatstherush-ca-2/,,
903144,The Resilient Urban Systems &amp; Habitat RUSH Initiative whatstherush.ca,CA,Canada,British Columbia,North Saanich,,,"The RUSH Initiative is a cross sectoral collaboration to create rapid resilience in record time by engaging people in creating the conditions for health now, and into the future. Our approach combines nature-inspired design, community mapping and a focus on health with watersheds as a primary indicator. By showcasing the research, creativity, and innovation happening in this region on an interactive landing page, we hope to provide a shared language on the vulnerabilities and opportunities for long-term health and climate action. We want to change the critical questions that get asked in planning meetings such as: How is a development proposal an opportunity to increase resilience to climate-related events? How can we support neighbourhoods to adapt and thrive in changing conditions? If we extend and connect the ecosystem features across the urban landscape, what are all the benefits people would feel? How can we work with Nature to create a quality of life for all? This is a tool for people to connect habitats, restore watersheds, feel a sense of belonging, and start conversations that help us reverse the trend of climate change, pollution and hopelessness. Climate change is a real bummer but reversing the trend is at our fingertips and in our footprints. The Resilient Urban Systems & Habitat (RUSH) Initiative is about rapid resilience in record time. Join this collective creation to mapping the difference we’re all making. Comparing datasets on personal and planetary hea...",https://whatstherush.ca/,,,food,,,transition_network,13729,,,,48.6326301,-123.4257138,collective,"Transition Group, Community Growing, Other food projects, Nature, Community hub or activities, Art / creativity, Community visioning / imagination work, Building local networks, Local economy or new economy projects, Social Justice / Just Transition activities, Youth or education projects, Share, Repair or reuse, Energy, Transport, Other",7,https://maps.transitionnetwork.org/group/the-resilient-urban-systems-habitat-rush-initiative-whatstherush-ca/,,
903605,Transition Bridge South Shore,CA,Canada,Nova Scotia,Bridgewater,,,"Born out of Transition Bay St Margarets, 2 former steering committee members moved to Bridgewater to start a living Co-op where a village of sustainable houses will be built. As a community Natura Holdings Co-op LTD will use the principals of permaculture and Transition Town movement to thrive. Transition Bridge South Shore will work with local like minded groups to build resilience in the Shouth Shore area.",http://www.naturaltd.com,,,,,,transition_network,1516,,,,44.3608013,-64.51107502,collective,Transition Group,8,https://maps.transitionnetwork.org/group/transition-bridge-south-shore/,,
903973,Transition Cornwall+,CA,Canada,ON,Cornwall,,,"Located in Eastern Ontario, Canada, Transition Cornwall+ is a community group created to build resilience and sustainability in Cornwall and the surrounding rural area of Stormont, Dundas and Glengarry (the + in our name,) in preparation for the combined challenges of peak oil, climate change and global economic instability. We believe that with thoughtful and deliberate planning, the transition to life without cheap fuel will be far gentler, and our community can become an even more fulfilling, socially connected, sustainable and self-reliant place to live. But we have to act together, and we have to act now. Our Purpose Transition Cornwall+ aims to inspire everyone in the Cornwall area to work together to increase our community’s capacity to thrive in the face of peak oil, climate change and global economic instability. We intend to: -raise awareness about these upcoming challenges -work with people and groups already active with these issues -lead a dynamic community process that unleashes the collective genius of our citizens for imagining and planning for a better future -create and implement a long-term plan to systematically reduce fossil fuel dependency in the Cornwall area.",http://transitioncornwall.com/,,,food,,,transition_network,737,,,,45.0275,-74.74,collective,"Transition Group, Community Growing, Other food projects, Nature, Festivals, fairs or events, Community visioning / imagination work, Building local networks, Share, Repair or reuse, Energy, Transport",5,https://maps.transitionnetwork.org/group/cornwall-and-area/,,
903493,Transition Kamloops,CA,Canada,BC,Kamloops,,,"Transition Kamloops is an organization focused on increasing local resilience and self-sufficiency in food, water, energy, culture and wellness. We emphasize a local economy, healthy ecosystems, and grassroots community building, while reducing our dependence on fossil fuels. We believe in a better way: a community that sustains life in all its diversity, strives for equality and justice and invests in the future. Learn more at https://www.facebook.com/transitionkamloops/",http://www.transitionkamloops.net,,,food,,,transition_network,5960,,,,50.6692965,-120.3474689,collective,"Transition Group, Community Growing, Other food projects, Nature, Community hub or activities, Festivals, fairs or events, Art / creativity, Community visioning / imagination work, Building local networks, Local economy or new economy projects, Wellbeing or Inner Transition, Social Justice / Just Transition activities, Youth or education projects, Share, Repair or reuse, Energy, Transport, Other",6,https://maps.transitionnetwork.org/group/transition-kamloops/,,
903371,Transition Medicine Hat,CA,Canada,Alberta,Medicine Hat,,,"Transition Medicine Hat promotes sustainable living in southeastern Alberta, Canada, through community, demonstration and instruction. We encourage a gradual shift to a local economy that is less dependent on fossil fuels. Our community will become more sustainable, and at the same time, more resilient to changes. In keeping with the Transition approach, we feel that supporting current positive actions will bring faster change than complaining about negative actions. With this in mind, we have two main areas of interest: renewable energy and regenerative agriculture. With abundant sunshine and wind, southern Alberta is quickly developing into a major source of renewable energy. Our group encourages new projects to use best practices. Our website features a new section: View of Canada to support more local tourism and to improve Canadians' knowledge of our own country. A description and about ten photos of each of Canada's 39 natural regions provide a relatively concise image of our beautiful country.",https://transitionmedicinehat.ca/,,,food,,,transition_network,6453,,,,50.0290268,-110.6735229,collective,"Transition Group, Community Growing",9,https://maps.transitionnetwork.org/group/transition-medicine-hat/,,
