id,name,country_code,country_name,state_province,city,registration_id,registration_type,description,website,email,phone,framework_area,ntee_code,icnpo_code,source,source_id,last_filing_year,annual_revenue,employee_count,lat,lon,model_type,tags,alignment_score,evidence_url,evidence_quote,last_verified_at
696512,DataFirst,ZA,South Africa,,,,,Open Data Portal of the University of Cape Town,https://www.datafirst.uct.ac.za,,,education,,,wikidata,Q97153947,,,,-30.56,22.94,nonprofit,tier_b,3,,,
692251,Desmond Tutu HIV Foundation,ZA,South Africa,,,,,nonprofit organization founded to provide treatment for and conduct HIV/AIDS research,http://desmondtutuhivfoundation.org.za/,,,healthcare,,,wikidata,Q5264812,,,,-30.56,22.94,foundation,tier_b,2,,,
692652,Harold Porter National Botanical Garden,ZA,South Africa,,,,,"conservation area at Betty's Bay in the Western Cape, South Africa",,,,ecology,,,wikidata,Q5662054,,,,-30.56,22.94,nonprofit,tier_b,2,,,
692585,Indigenous Bulb Association of South Africa,ZA,South Africa,,,,,,,,,democracy,,,wikidata,Q138762856,,,,-30.56,22.94,federation,tier_c,3,,,
692802,North-West University Department of Agriculture Conservation and Environment,ZA,South Africa,,,,,academic department,,,,ecology,,,wikidata,Q100948414,,,,-30.56,22.94,education_inst,tier_b,2,,,
692282,Police and Prisons Civil Rights Union,ZA,South Africa,,,,,trade union in South Africa,http://www.popcru.org.za/,,,conflict,,,wikidata,Q7209557,,,,-30.56,22.94,nonprofit,tier_b,4,,,
692363,Restorative Justice Centre,ZA,South Africa,,,,,"nonprofit organization in Pretoria, South Africa",http://www.rjc.co.za/,,,conflict,,,wikidata,Q30288542,,,,-30.56,22.94,nonprofit,tier_b,4,,,
692849,Rhodes University Environmental Education and Sustainability Unit,ZA,South Africa,,,,,academic department,,,,education,,,wikidata,Q100943816,,,,-30.56,22.94,education_inst,tier_b,2,,,
692297,Small Enterprise Foundation,ZA,South Africa,,,,,microfinance institution operating primarily in the Limpopo province of South Africa,http://www.sef.co.za/,,,democracy,,,wikidata,Q7542762,,,,-30.56,22.94,foundation,tier_b,2,,,
692285,South African Human Rights Commission,ZA,South Africa,,,,,South African institution for the protection of democracy,,,,democracy,,,wikidata,Q7565704,,,,-30.56,22.94,government,tier_b,2,,,
692716,Southern Africa Society for Disaster Reduction (South Africa) and Department of Cooperative Governance (South Africa).,ZA,South Africa,,,,,organisation involved in scholarly research,,,,democracy,,,wikidata,Q74543978,,,,-30.56,22.94,cooperative,tier_b,6,,,
692312,Southern African Foundation for the Conservation of Coastal Birds,ZA,South Africa,,,,,seabird rehabilitation organisation,http://www.sanccob.co.za/,,,ecology,,,wikidata,Q7388652,,,,-30.56,22.94,foundation,tier_b,3,,,
692271,Steve Biko Foundation,ZA,South Africa,,,,,community development organisation in South Africa,,,,democracy,,,wikidata,Q7611956,,,,-30.56,22.94,foundation,tier_b,3,,,
696465,Sustainable Livelihoods Foundation,ZA,South Africa,,,,,"nonprofit organization in Cape Town, South Africa",http://www.livelihoods.org.za,,,democracy,,,wikidata,Q61930878,,,,-30.56,22.94,foundation,tier_b,2,,,
763248,AIDS Healthcare Foundation,ZM,Zambia,,,,,"Zambian country program of AIDS Healthcare Foundation, providing HIV/AIDS prevention, testing and treatment",,,,healthcare,,,wikidata,Q136166980,,,,-13.13,27.85,foundation,,3,,,
761955,Centre for Environment Justice,ZM,Zambia,,,,,Zambian non governmental organization that promotes climate and environmental justice,https://cejzambia.org,,,ecology,,,wikidata,Q136230662,,,,-13.13,27.85,research,,6,,,
763259,Chalo Chatu Foundation,ZM,Zambia,,,,,Zambian non-profit charitable organization,,,,democracy,,,wikidata,Q56826397,,,,-13.13,27.85,foundation,,2,,,
761958,Citizens Network for Community Development Zambia,ZM,Zambia,,,,,"A non-profit organization focused on empowering citizens, particularly youth and women, to drive social change, advocate for rights, and advance climate resilience in Zambia.",https://citizensnetworkzambia.org/,,,ecology,,,wikidata,Q136472370,,,,-13.13,27.85,federation,,5,,,
761956,Copper Rose Zambia,ZM,Zambia,,,,,"Zambian youth-led non-governmental organization working on women’s health, sexual and reproductive rights",https://www.copperrosezambia.org,,,healthcare,,,wikidata,Q136192055,,,,-13.13,27.85,nonprofit,,4,,,
763276,Environment Savers Of Zambia,ZM,Zambia,,,,,Zambian NGO focused on environmental protection and climate action,https://environmentsaversofzambia.wordpress.com/contact/,,,ecology,,,wikidata,Q136192095,,,,-13.13,27.85,nonprofit,,2,,,
763251,Equality Rights Africa Organization(Zambia),ZM,Zambia,,,,,"non-governmental organization advocating for equality, inclusion, and human rights",https://erao-africa.org/,,,democracy,,,wikidata,Q136192233,,,,-13.13,27.85,nonprofit,,2,,,
763249,Grassfly Foundation,ZM,Zambia,,,,,Zambian non-governmental organization focused on youth empowerment,https://grassflyfoundation.com/,,,democracy,,,wikidata,Q136192266,,,,-13.13,27.85,foundation,,3,,,
763258,Keepers Zambia Foundation,ZM,Zambia,,,,,A non governmental organization in Zambia,,,,democracy,,,wikidata,Q136165328,,,,-13.13,27.85,foundation,,2,,,
763247,New Hope Waves,ZM,Zambia,,,,,Zambian non-profit organization empowering youth through education and skills development,https://newhopewaves.org/,,,education,,,wikidata,Q136192481,,,,-13.13,27.85,nonprofit,,2,,,
763271,Non-governmental Gender Organizations’ Coordinating Council,ZM,Zambia,,,,,Umbrella organization in Zambia coordinating gender-focused and women’s rights NGOs,https://ngocc.org.zm/,,,democracy,,,wikidata,Q136192505,,,,-13.13,27.85,nonprofit,,2,,,
761957,Pact Zambia,ZM,Zambia,,,,,"International development NGO operating in Zambia; works on health, HIV/AIDS, maternal and child health, TB, community empowerment",https://www.pactworld.org/country/zambia,,,healthcare,,,wikidata,Q136452509,,,,-13.13,27.85,nonprofit,,2,,,
761959,Rusangu University School of Environmental Health,ZM,Zambia,,,,,academic department,,,,education,,,wikidata,Q100945379,,,,-13.13,27.85,education_inst,,3,,,
763263,The YANA Foundation,ZM,Zambia,,,,,Non-governmental organization focused on youth empowerment and community development,https://www.theyanafoundation.org/what-we-do,,,democracy,,,wikidata,Q136450802,,,,-13.13,27.85,foundation,,4,,,
763278,Women for Change,ZM,Zambia,,,,,Non-governmental organization in Zambia promoting gender equality and the rights of rural women and children,,,,democracy,,,wikidata,Q131745362,,,,-13.13,27.85,nonprofit,,2,,,
761953,Women’s Alliance for Equality,ZM,Zambia,,,,,"Zambian feminist and LGBTIQ+ rights organization focused on equality, advocacy, and community empowerment.",,,,democracy,,,wikidata,Q135832864,,,,-13.13,27.85,federation,,3,,,
761954,Zambia’s Child,ZM,Zambia,,,,,Christian non-governmental organisation based in Australia that works in Zambia to provide Christ-centred education and community development for vulnerable children,https://zambiaschild.ngo/,,,education,,,wikidata,Q136452453,,,,-13.13,27.85,nonprofit,,2,,,
