id,name,country_code,country_name,state_province,city,registration_id,registration_type,description,website,email,phone,framework_area,ntee_code,icnpo_code,source,source_id,last_filing_year,annual_revenue,employee_count,lat,lon,model_type,tags,alignment_score,evidence_url,evidence_quote,last_verified_at
713033,Agencia Presentes,AR,Argentina,,,,,news agency focused on LGBT and human rights issues,https://agenciapresentes.org/,,,democracy,,,wikidata,Q111851392,,,,-38.42,-63.62,nonprofit,tier_b,2,,,
713007,Gays for Civil Rights,AR,Argentina,,,,,LGBT organization of Argentina,,,,democracy,,,wikidata,Q124347998,,,,-38.42,-63.62,nonprofit,tier_b,4,,,
712764,Grandmothers of the Plaza de Mayo,AR,Argentina,,,,,Argentine human rights organization,http://www.abuelas.org.ar/,,,democracy,,,wikidata,Q335746,,,,-38.42,-63.62,nonprofit,tier_b,2,,,
712963,Maricas Unidas Argentinas,AR,Argentina,,,,,Argentine queer mutual aid group of the 1950s,,,,cooperatives,,,wikidata,Q137699885,,,,-38.42,-63.62,nonprofit,tier_b,3,,,
712814,Servicio Paz y Justicia,AR,Argentina,,,,,latin American human rights organisation,,,,conflict,,,wikidata,Q3480529,,,,-38.42,-63.62,nonprofit,tier_b,2,,,
708074,Arena,AU,Australia,,,,,Australian publishing co-operative,https://arena.org.au,,,cooperatives,,,wikidata,Q4788862,,,,-25.27,133.78,nonprofit,tier_b,3,,,
697568,Australian Foundation for Disability,AU,Australia,,,,,Australian charitable organisation,https://www.afford.com.au/,,,democracy,,,wikidata,Q28183691,,,,-25.27,133.78,foundation,tier_b,3,,,
708070,Australian Human Rights Commission,AU,Australia,,,,,human rights institution of the Australian Government,https://www.humanrights.gov.au/,,,democracy,,,wikidata,Q4056090,,,,-25.27,133.78,government,tier_b,2,,,
697592,Australian Literacy and Numeracy Foundation,AU,Australia,,,,,Australian charity,https://alnf.org/,,,education,,,wikidata,Q118130868,,,,-25.27,133.78,foundation,tier_b,3,,,
708182,Australian Privacy Foundation,AU,Australia,,,,,NGO formed for the purpose of protecting the privacy rights of Australians,https://privacy.org.au/,,,democracy,,,wikidata,Q4824577,,,,-25.27,133.78,foundation,tier_b,3,,,
697512,Beyond Blue,AU,Australia,,,,,Australian mental health and wellbeing support charitable organization,https://www.beyondblue.org.au/,,,healthcare,,,wikidata,Q2900494,,,,-25.27,133.78,nonprofit,tier_b,2,,,
697600,Bobby Goldsmith Foundation,AU,Australia,,,,,Australian HIV charitable organisation,https://www.bgf.org.au/,,,healthcare,,,wikidata,Q99763561,,,,-25.27,133.78,foundation,tier_b,2,,,
697497,Community Colleges Australia,AU,Australia,,,,,peak body of Australian adult and community education providers,https://cca.edu.au,,,education,,,wikidata,Q117485423,,,,-25.27,133.78,education_inst,tier_b,2,,,
708041,Creation Ministries International,AU,Australia,,,,,young Earth creationist advocacy organization [FILTERED: out of scope],http://creation.com,,,democracy,,,wikidata,Q2141331,,,,-25.27,133.78,nonprofit,tier_b,3,,,
697593,Croakey Health Media,AU,Australia,,,,,Australian public interest media organisation,https://www.croakey.org/,,,healthcare,,,wikidata,Q126125177,,,,-25.27,133.78,nonprofit,tier_b,2,,,
697229,First Nations Workers Alliance,AU,Australia,,,,,union for Indigenous Australians,,,,democracy,,,wikidata,Q60742377,,,,-25.27,133.78,federation,tier_b,3,,,
697307,Friends of Parks,AU,Australia,,,,,South Australian organisation representing community conservation groups,http://www.friendsofparkssa.org.au/,,,ecology,,,wikidata,Q5504298,,,,-25.27,133.78,nonprofit,tier_b,2,,,
697681,Graylands Hospital,AU,Australia,,,,,"largest mental health inpatient facility, and the only public stand-alone psychiatric teaching hospital, in Western Australia",https://www.nmhs.health.wa.gov.au/Hospitals-and-Services/Hospitals/Graylands,,,healthcare,,,wikidata,Q5598317,,,,-25.27,133.78,nonprofit,tier_b,2,,,
708065,Indigenous All Stars,AU,Australia,,,,,rugby league team,,,,democracy,,,wikidata,Q3590556,,,,-25.27,133.78,nonprofit,tier_b,3,,,
697707,Indigenous Knowledge Centre,AU,Australia,,,,,type of library service operating in Australia to serve Indigenous clients,,,,education,,,wikidata,Q6024606,,,,-25.27,133.78,nonprofit,tier_b,3,,,
697612,Indigenous Literacy Foundation,AU,Australia,,,,,Australian charity,https://www.indigenousliteracyfoundation.org.au,,,education,,,wikidata,Q72561423,,,,-25.27,133.78,foundation,tier_b,6,,,
697192,Intersex Human Rights Australia,AU,Australia,,,,,organization,http://ihra.org.au/,,,democracy,,,wikidata,Q16960748,,,,-25.27,133.78,nonprofit,tier_b,2,,,
697590,Muurrbay Aboriginal Language and Culture Co-operative,AU,Australia,,,,,centre of Aboriginal Australian languages in New South Wales,https://muurrbay.org.au/,,,cooperatives,,,wikidata,Q121854696,,,,-25.27,133.78,cooperative,tier_b,7,,,
697619,Nature Foundation,AU,Australia,,,,,South Australian nature conservation organisation,https://www.naturefoundation.org.au,,,ecology,,,wikidata,Q110516911,,,,-25.27,133.78,foundation,tier_b,3,,,
697621,Studio Schools of Australia,AU,Australia,,,,,residential Indigenous schools on-country,http://www.studioschools.edu.au/,,,education,,,wikidata,Q130311888,,,,-25.27,133.78,education_inst,tier_b,3,,,
697814,The Park Centre for Mental Health,AU,Australia,,,,,hospital in Australia,https://www.health.qld.gov.au/services/westmoreton/the-park.asp,,,healthcare,,,wikidata,Q7756132,,,,-25.27,133.78,research,tier_b,2,,,
697816,Thomas Embling Hospital,AU,Australia,,,,,"mental health hospital in Melbourne, Australia",http://www.forensicare.vic.gov.au/page.aspx?o=teh,,,healthcare,,,wikidata,Q7789350,,,,-25.27,133.78,nonprofit,tier_b,2,,,
697606,Zambi Wildlife Foundation Limited,AU,Australia,,,,,non-profit foundation for the preservation and welfare of all animals,https://www.zambiwildlifefoundation.org/,,,ecology,,,wikidata,Q119248151,,,,-25.27,133.78,foundation,tier_b,2,,,
762185,Cooperation International pour Developmental et Solidarite,BE,Belgium,,,,,umbrella organization for Catholic development agencies,http://www.cidse.org,,,democracy,,,wikidata,Q2931491,,,,50.5,4.47,cooperative,,3,,,
762098,Cooperatives Europe,BE,Belgium,,,,,umbrella organization of European cooperative organizations,https://coopseurope.coop/,,,cooperatives,,,wikidata,Q25048042,,,,50.5,4.47,cooperative,,9,,,
762189,Coppieters Foundation,BE,Belgium,,,,,European political foundation affiliated to the European Free Alliance,https://ideasforeurope.eu/,,,democracy,,,wikidata,Q16829132,,,,50.5,4.47,foundation,,2,,,
762097,European Association of Co-operative Banks,BE,Belgium,,,,,organization,http://www.eacb.coop,,,cooperatives,,,wikidata,Q1376341,,,,50.5,4.47,cooperative,,6,,,
762100,European Atomic Energy Community,BE,Belgium,,,,,European interstate body on atomic energy,,,,energy_digital,,,wikidata,Q8919,,,,50.5,4.47,nonprofit,,2,,,
762180,European Educational Exchanges – Youth for Understanding,BE,Belgium,,,,,umbrella for national Youth For Understanding organisations in Europe,http://www.eee-yfu.org/,,,education,,,wikidata,Q5412536,,,,50.5,4.47,nonprofit,,2,,,
762160,European Energy Award,BE,Belgium,,,,,European certification for sustainable energy and climate policy,,,,ecology,,,wikidata,Q1376535,,,,50.5,4.47,nonprofit,,2,,,
762199,"European Federation of Food, Agriculture and Tourism Trade Unions",BE,Belgium,,,,,European union federation,http://www.effat.org,,,food,,,wikidata,Q2350076,,,,50.5,4.47,federation,,2,,,
762166,European Foundation for Management Development,BE,Belgium,,,,,organization,https://www.efmdglobal.org/,,,democracy,,,wikidata,Q1376622,,,,50.5,4.47,foundation,,2,,,
762130,European Renewable Energy Council,BE,Belgium,,,,,defunct trade association,https://eurec.be/,,,energy_digital,,,wikidata,Q649249,,,,50.5,4.47,nonprofit,,4,,,
762186,European Women's Lobby,BE,Belgium,,,,,women's rights organization,https://www.womenlobby.org,,,democracy,,,wikidata,Q3257610,,,,50.5,4.47,nonprofit,,2,,,
762095,Foodwatch,BE,Belgium,,,,,consumer rights organisation,https://www.foodwatch.org/at,,,food,,,wikidata,Q288182,,,,50.5,4.47,nonprofit,,2,,,
762188,Foundation for European Progressive Studies,BE,Belgium,,,,,European political foundation affiliated to the Party of European Socialists,https://feps-europe.eu/,,,democracy,,,wikidata,Q16838229,,,,50.5,4.47,foundation,,2,,,
762096,International Cooperative Alliance,BE,Belgium,,,,,federation representing co-operatives and the worldwide co-operative movement,https://www.ica.coop/en,,,cooperatives,,,wikidata,Q1069030,,,,50.5,4.47,cooperative,,10,,,
762158,International Falcon Movement – Socialist Educational International,BE,Belgium,,,,,Youth association.,http://www.ifm-sei.org,,,education,,,wikidata,Q1414468,,,,50.5,4.47,nonprofit,,2,,,
762194,National Association of the Disabled of the Army,BE,Belgium,,,,,Belgian disability rights organization for veterans,https://ania-nvil.be/,,,democracy,,,wikidata,Q120134386,,,,50.5,4.47,federation,,2,,,
762099,Sciensano,BE,Belgium,,,,,"national public health institute, animal health and food security agency of Belgium",https://www.sciensano.be/,,,healthcare,,,wikidata,Q55508919,,,,50.5,4.47,nonprofit,,2,,,
690770,Bolivian Queers Movement,BO,Bolivia,,,,,collective of activists from the indigenous LGBT+ community in Bolivia,,,,democracy,,,wikidata,Q126551546,,,,-16.29,-63.59,nonprofit,tier_b,7,,,
690715,Confederation of Indigenous Peoples of Bolivia,BO,Bolivia,,,,,Bolivian organization of indigenous people,,,,democracy,,,wikidata,Q5159823,,,,-16.29,-63.59,federation,tier_b,3,,,
690766,Indigenous Central of the Amazonian Region of Bolivia,BO,Bolivia,,,,,indigenous rights organization in Bolivia,,,,democracy,,,wikidata,Q135922896,,,,-16.29,-63.59,nonprofit,tier_b,4,,,
691100,"Library, AECID Centro de Formación de la Cooperacion Española",BO,Bolivia,,,,,library,http://www.aecid-cf.bo,,,education,,,wikidata,Q85682307,,,,-16.29,-63.59,cooperative,tier_b,3,,,
691172,Open Data portal Bolivia,BO,Bolivia,,,,,,http://opendatabolivia.github.io/,,,energy_digital,,,wikidata,Q97063703,,,,-16.29,-63.59,nonprofit,tier_c,3,,,
700981,A Friburguense,BR,Brazil,,,,,Mutual aid society and popular economy of Nova Friburgo (RJ),,,,cooperatives,,,wikidata,Q139077994,,,,-14.24,-51.93,nonprofit,tier_b,3,,,
700932,Organização das Cooperativas Brasileiras,BR,Brazil,,,,,brazilian cooperative union organization,http://www.ocb.org.br,,,cooperatives,,,wikidata,Q20050412,,,,-14.24,-51.93,cooperative,tier_b,6,,,
700855,Rede Virtual de Bibliotecas,BR,Brazil,,,,,"library Cooperative library network, located in Brasília - DF, Brazil, coordinated by the Federal Senate Library",https://www12.senado.leg.br/institucional/biblioteca/rvbi/a-rvbi,,,education,,,wikidata,Q10358295,,,,-14.24,-51.93,nonprofit,tier_b,3,,,
702496,Xingu Indigenous Park,BR,Brazil,,,,,national park in Brazil,,,,democracy,,,wikidata,Q183444,,,,-14.24,-51.93,nonprofit,tier_b,3,,,
707726,B.C. Women's Hospital & Health Centre,CA,Canada,,,,,hospital in Canada,http://www.bcwomens.ca/,,,healthcare,,,wikidata,Q4833789,,,,56.13,-106.35,nonprofit,tier_b,2,,,
706530,BC Libraries Cooperative,CA,Canada,,,,,organization,http://bc.libraries.coop/,,,cooperatives,,,wikidata,Q76612323,,,,56.13,-106.35,cooperative,tier_b,6,,,
707719,Centre for Addiction and Mental Health,CA,Canada,,,,,"hospital at multiple locations in Ontario, Canada",http://www.camh.ca/en/hospital/Pages/home.aspx,,,healthcare,,,wikidata,Q2945513,,,,56.13,-106.35,research,tier_b,2,,,
707763,Douglas Mental Health University Institute,CA,Canada,,,,,hospital in Canada,http://www.douglas.qc.ca/?&locale=fr,,,healthcare,,,wikidata,Q3152768,,,,56.13,-106.35,research,tier_b,2,,,
706109,International Academy of Law and Mental Health,CA,Canada,,,,,science academy,https://ialmh.org/,,,healthcare,,,wikidata,Q107640304,,,,56.13,-106.35,education_inst,tier_b,2,,,
707922,Northeast Community Health Centre,CA,Canada,,,,,hospital in Canada,https://www.albertahealthservices.ca/info/facility.aspx?id=3904,,,healthcare,,,wikidata,Q7057862,,,,56.13,-106.35,nonprofit,tier_b,5,,,
707875,Nunavut Public Library Services,CA,Canada,,,,,"library system in Nunavut, Canada",http://www.publiclibraries.nu.ca/,,,education,,,wikidata,Q7069754,,,,56.13,-106.35,nonprofit,tier_b,3,,,
707920,Ontario Shores Centre for Mental Health Sciences,CA,Canada,,,,,hospital in Canada,http://www.ontarioshores.ca/,,,healthcare,,,wikidata,Q7094896,,,,56.13,-106.35,research,tier_b,2,,,
706210,Platform,CA,Canada,,,,,"black, indigenous, and racialized women and gender-diverse folks association",https://theplatform.ca/,,,democracy,,,wikidata,Q124472246,,,,56.13,-106.35,nonprofit,tier_b,4,,,
707938,Royal Ottawa Mental Health Centre,CA,Canada,,,,,"mental health facility in Ottawa, Ontario, Canada",http://www.theroyal.ca,,,healthcare,,,wikidata,Q7374657,,,,56.13,-106.35,nonprofit,tier_b,2,,,
707732,University Institute of Mental Health,CA,Canada,,,,,"psychiatric hospital in Quebec City, Canada",http://www.institutsmq.qc.ca,,,healthcare,,,wikidata,Q3152767,,,,56.13,-106.35,research,tier_b,2,,,
712100,Chile Open Data Portal,CL,Chile,,,,,Open data portal of Chile,https://datos.gob.cl/,,,energy_digital,,,wikidata,Q108381608,,,,-35.68,-71.54,nonprofit,tier_b,3,,,
711711,Chilean Human Rights Commission,CL,Chile,,,,,"human rights organization based in Santiago, Chile",,,,democracy,,,wikidata,Q5779090,,,,-35.68,-71.54,government,tier_b,2,,,
762745,Data Observatory Foundation,CL,Chile,,,,,"nonprofit organization in Santiago, Chile",https://www.dataobservatory.net,,,energy_digital,,,wikidata,Q112752001,,,,-35.68,-71.54,foundation,,2,,,
762268,Educational Justice Center,CL,Chile,,,,,Chilean research center,https://centrojusticiaeducacional.uc.cl/,,,education,,,wikidata,Q124130372,,,,-35.68,-71.54,nonprofit,,2,,,
762269,Indigenous movement in Chile,CL,Chile,,,,,,,,,democracy,,,wikidata,Q1286774,,,,-35.68,-71.54,nonprofit,,3,,,
711881,Institute of Ecology and Biodiversity,CL,Chile,,,,,"nonprofit organization in Santiago, Chile",https://ieb-chile.cl/,,,ecology,,,wikidata,Q108737542,,,,-35.68,-71.54,research,tier_b,2,,,
711768,"Movimiento Contra la Tortura ""Sebastián Acevedo""",CL,Chile,,,,,"human rights group in Santiago, Chile",,,,democracy,,,wikidata,Q6025290,,,,-35.68,-71.54,nonprofit,tier_b,2,,,
762744,Neurounion Biomedical Foundation,CL,Chile,,,,,"nonprofit organization in Santiago, Chile",http://www.neurounion.com/en/qs.php,,,healthcare,,,wikidata,Q56583019,,,,-35.68,-71.54,foundation,,2,,,
762742,Pro-Emancipation Movement of Chilean Women,CL,Chile,,,,,Women's rights NGO,,,,democracy,,,wikidata,Q6025210,,,,-35.68,-71.54,nonprofit,,2,,,
711899,South Research and Defense Center,CL,Chile,,,,,Human rights organization in Chile,https://www.cidsur.cl/,,,democracy,,,wikidata,Q106881155,,,,-35.68,-71.54,research,tier_b,2,,,
762743,Telethon Foundation,CL,Chile,,,,,"nonprofit organization in Santiago, Chile",http://www.teleton.cl/,,,democracy,,,wikidata,Q30270487,,,,-35.68,-71.54,foundation,,2,,,
704043,Centro de Documentación y Biblioteca del Centro de Formación de la Cooperación Española en Cartagena de Indias,CO,Colombia,,,,,library,http://www.aecidcf.org.co/,,,education,,,wikidata,Q85682400,,,,4.57,-74.3,cooperative,tier_b,3,,,
703414,Colectivo de Abogados “José Alvear Restrepo”,CO,Colombia,,,,,human rights organization in Colombia,https://www.colectivodeabogados.org/,,,democracy,,,wikidata,Q131848237,,,,4.57,-74.3,nonprofit,tier_b,2,,,
703395,Huottuja Foundation,CO,Colombia,,,,,international non-governmental organization dedicated to the heritage of the Huottuja (Piaroa) people,https://www.huottuja.org,,,recreation_arts,,,wikidata,Q109476530,,,,4.57,-74.3,foundation,tier_b,2,,,
703340,Movimiento Nacional de Víctimas de Crímenes de Estado,CO,Colombia,,,,,human rights organization in Colombia,http://www.movimientodevictimas.org,,,democracy,,,wikidata,Q44745127,,,,4.57,-74.3,nonprofit,tier_b,2,,,
703259,National Indigenous Organization of Colombia,CO,Colombia,,,,,,http://www.onic.org.co/,,,democracy,,,wikidata,Q6973505,,,,4.57,-74.3,nonprofit,tier_c,3,,,
704049,Open Data Colombia,CO,Colombia,,,,,,https://www.datos.gov.co,,,energy_digital,,,wikidata,Q97073891,,,,4.57,-74.3,nonprofit,tier_c,3,,,
703367,Organization of the Indigenous Towns of the Colombian Amazonia,CO,Colombia,,,,,,https://www.opiac.org.co/,,,democracy,,,wikidata,Q98127302,,,,4.57,-74.3,nonprofit,tier_c,3,,,
703251,Popular Women's Organization,CO,Colombia,,,,,grassroots human rights organization in Colombia,http://organizacionfemeninapopular.org/,,,democracy,,,wikidata,Q10611381,,,,4.57,-74.3,nonprofit,tier_b,3,,,
703406,Puerto Carreño Tourist Council,CO,Colombia,,,,,autonomous self-regulated cooperative commission of members holding an interest in real-estate and the prosperity of the tourism sector in Puerto Carreño,https://www.puertocarreno.com,,,cooperatives,,,wikidata,Q118443935,,,,4.57,-74.3,nonprofit,tier_b,3,,,
703695,Universidad Autónoma Indígena Intercultural,CO,Colombia,,,,,indigenous university in Colombia,https://uaiinpebi-cric.edu.co/,,,education,,,wikidata,Q125956076,,,,4.57,-74.3,nonprofit,tier_b,3,,,
703362,Vichada Tourism Council,CO,Colombia,,,,,"civil society cooperative and non-governmental organization dedicated to the tourism industry in Vichada, Colombia",https://www.vichada.org/,,,cooperatives,,,wikidata,Q118385571,,,,4.57,-74.3,nonprofit,tier_b,3,,,
689466,Accessibility without Exclusion,CR,Costa Rica,,,,,disability rights political party in Costa Rica [FILTERED: out of scope],http://partidopase.org,,,democracy,,,wikidata,Q4672493,,,,9.75,-83.75,nonprofit,tier_b,3,,,
689557,Frente por los Derechos Igualitarios,CR,Costa Rica,,,,,"FDI is a union of organizations, groups and independent activists working to ensure the enjoyment of human rights",,,,democracy,,,wikidata,Q25905940,,,,9.75,-83.75,nonprofit,tier_b,2,,,
689662,National Institute for Cooperative Development,CR,Costa Rica,,,,,public institution in charge of the promotion and development of cooperatives in Costa Rica,http://www.infocoop.go.cr/,,,cooperatives,,,wikidata,Q17634864,,,,9.75,-83.75,cooperative,tier_b,9,,,
702747,Foundation for Human Rights in Cuba,CU,Cuba,,,,,,http://www.fhrcuba.org,,,democracy,,,wikidata,Q5474435,,,,21.52,-77.78,foundation,tier_c,4,,,
702753,Patriotic Union of Cuba,CU,Cuba,,,,,Cuban human rights organization,http://www.unpacu.org/,,,democracy,,,wikidata,Q15984868,,,,21.52,-77.78,nonprofit,tier_b,2,,,
762208,Jardín Botanico,DO,Dominican Republic,,,,,"environmental education center in Calarcá, Colombia",http://www.jardinbotanicoquindio.org,,,education,,,wikidata,Q6159869,,,,18.74,-70.16,nonprofit,,2,,,
719615,dominicana.gob.do,DO,Dominican Republic,,,,,Open data in Dominican Republic,http://dominicana.gob.do/,,,energy_digital,,,wikidata,Q97142453,,,,18.74,-70.16,nonprofit,tier_b,3,,,
691177,Conaie,EC,Ecuador,,,,,indigenous people's organization in Ecuador,https://conaie.org/,,,democracy,,,wikidata,Q1024020,,,,-1.83,-78.18,nonprofit,tier_b,3,,,
691182,Confederation of Indigenous Nationalities of the Ecuadorian Amazon,EC,Ecuador,,,,,ecuadorian indigenous political organization,https://confeniae.net/,,,democracy,,,wikidata,Q1024097,,,,-1.83,-78.18,federation,tier_b,3,,,
691183,Ecuarunari,EC,Ecuador,,,,,ecuadorian indigenous organization,,,,democracy,,,wikidata,Q1274231,,,,-1.83,-78.18,nonprofit,tier_b,3,,,
691358,Guayaqueer,EC,Ecuador,,,,,LGBT artist collective and cultural center,,,,recreation_arts,,,wikidata,Q137169154,,,,-1.83,-78.18,nonprofit,tier_b,3,,,
762341,Indigenous movement in Ecuador,EC,Ecuador,,,,,,,,,democracy,,,wikidata,Q1661396,,,,-1.83,-78.18,nonprofit,,3,,,
762890,Khamai Foundation,EC,Ecuador,,,,,"nonprofit organization in Quito, Ecuador",https://www.khamai.bio,,,democracy,,,wikidata,Q135095453,,,,-1.83,-78.18,foundation,,2,,,
691695,Open Data platform of the Republic of Ecuador.,EC,Ecuador,,,,,,,,,energy_digital,,,wikidata,Q97095863,,,,-1.83,-78.18,nonprofit,tier_c,3,,,
716195,Abbasyia Mental Health Hospital,EG,Egypt,,,,,hospital,,,,healthcare,,,wikidata,Q64576144,,,,26.82,30.8,nonprofit,tier_b,2,,,
715876,Adalah Center for Rights and Freedoms,EG,Egypt,,,,,Egyptian human rights organisation,,,,democracy,,,wikidata,Q69417618,,,,26.82,30.8,research,tier_b,2,,,
716252,"Al Farafrah Child & Youth Public Library, General Organization of Culture Palaces.",EG,Egypt,,,,,library in Egypt,,,,education,,,wikidata,Q68652981,,,,26.82,30.8,nonprofit,tier_b,2,,,
715867,Cairo Institute for Human Rights Studies,EG,Egypt,,,,,Egyptian human rights organisation,http://www.cihrs.org/?lang=en,,,democracy,,,wikidata,Q29914419,,,,26.82,30.8,research,tier_b,2,,,
716271,"Child and Youth Library in New Assiut, General Organization of Culture Palaces.",EG,Egypt,,,,,library in Egypt,,,,education,,,wikidata,Q68652990,,,,26.82,30.8,nonprofit,tier_b,2,,,
715882,Egyptian Commission for Rights and Freedoms,EG,Egypt,,,,,Egyptian human rights organisation,https://www.ec-rf.net/,,,democracy,,,wikidata,Q48740070,,,,26.82,30.8,government,tier_b,2,,,
715821,Egyptian Food Bank,EG,Egypt,,,,,non-governmental organization,https://www.efb.eg/,,,food,,,wikidata,Q16125206,,,,26.82,30.8,nonprofit,tier_b,4,,,
715817,Egyptian Initiative for Personal Rights,EG,Egypt,,,,,Egyptian human rights organization,http://www.eipr.org/en,,,democracy,,,wikidata,Q5348416,,,,26.82,30.8,nonprofit,tier_b,2,,,
716329,Egyptian Open Data initiative,EG,Egypt,,,,,,http://www.egypt.gov.eg/english/general/Open_Gov_Data_Initiative.aspx,,,energy_digital,,,wikidata,Q97011670,,,,26.82,30.8,nonprofit,tier_c,3,,,
717252,Center for Advancement of Rights and Democracy (CARD),ET,Ethiopia,,,,,A human rights Association,https://www.cardeth.org/,,,democracy,,,wikidata,Q135106487,,,,9.14,40.49,research,tier_b,2,,,
717241,Consortium of Ethiopian Human Rights Organizations,ET,Ethiopia,,,,,Ethiopian government agency,https://cehro.org/,,,democracy,,,wikidata,Q135274966,,,,9.14,40.49,nonprofit,tier_b,2,,,
717210,Ethiopian Human Rights Council,ET,Ethiopia,,,,,Ethiopian human rights non-governmental organisation created in 1991,https://ehrco.org,,,democracy,,,wikidata,Q104920376,,,,9.14,40.49,nonprofit,tier_b,2,,,
717242,Ethiopian Human Rights Defenders Center,ET,Ethiopia,,,,,Human rights defenders organization in Ethiopia,https://ethdefenders.org,,,democracy,,,wikidata,Q135748089,,,,9.14,40.49,nonprofit,tier_b,2,,,
717264,Ethiopian Women Development Organization,ET,Ethiopia,,,,,"Ethiopian non-governmental organization focused on women's rights, digital literacy, and gender equality",https://www.ewdoet.org/,,,education,,,wikidata,Q136714197,,,,9.14,40.49,nonprofit,tier_b,3,,,
717349,Haramaya University Department of Environmental Health,ET,Ethiopia,,,,,academic department,,,,healthcare,,,wikidata,Q100946233,,,,9.14,40.49,education_inst,tier_b,3,,,
717236,Sustainable Agriculture and Environmental Rehabilitation in Tigray (SAERT),ET,Ethiopia,,,,,A non governmental organization in Ethiopia,,,,food,,,wikidata,Q135482970,,,,9.14,40.49,nonprofit,tier_b,2,,,
762450,"Federation of Education, Research and Culture",FR,France,,,,,trade union of France,https://www.ferc-cgt.org,,,education,,,wikidata,Q3091556,,,,46.23,2.21,research,,2,,,
762451,"National Federation of Education, Culture and Vocational Training",FR,France,,,,,trade union of France,http://www.fo-fnecfp.fr/,,,education,,,wikidata,Q3091997,,,,46.23,2.21,federation,,2,,,
762448,Nicolas Bourbaki,FR,France,,,,,collective pseudonym for a group of mathematicians,https://bourbaki.fr,,,democracy,,,wikidata,Q190529,,,,46.23,2.21,nonprofit,,3,,,
698420,Arcus Foundation,GB,United Kingdom,,,,,"foundation focused on grantmaking related to LGBT rights, social justice, and ape conservation",https://www.arcusfoundation.org,,,ecology,,,wikidata,Q4787745,,,,55.38,-3.44,foundation,tier_b,6,,,
697998,National Association of Co-operative Officials,GB,United Kingdom,,,,,British trade union,,,,cooperatives,,,wikidata,Q6970627,,,,55.38,-3.44,cooperative,tier_b,6,,,
698038,National Union of Co-operative Insurance Society Employees,GB,United Kingdom,,,,,former trade union of the United Kingdom,,,,cooperatives,,,wikidata,Q6979115,,,,55.38,-3.44,cooperative,tier_b,6,,,
717001,Accra College of Education Community Library,GH,Ghana,,,,,library in Ghana,,,,education,,,wikidata,Q68652419,,,,7.95,-1.02,education_inst,tier_b,2,,,
716422,Amnesty International Ghana,GH,Ghana,,,,,human rights organization in Ghana,https://amnestyghana.org/,,,democracy,,,wikidata,Q62084651,,,,7.95,-1.02,nonprofit,tier_b,2,,,
716486,Centre for Popular Education and Human Rights - Ghana,GH,Ghana,,,,,formed on the premise of combating the impact of AIDS in Ghana,https://www.cepehrg.net/,,,healthcare,,,wikidata,Q107099204,,,,7.95,-1.02,research,tier_b,3,,,
716549,Christiansborg Archaeological Heritage Project,GH,Ghana,,,,,"Non-profit organization dedicated to community development through archaeology, heritage, art, and education programming",https://christiansborgarchaeologicalheritageproject.org/,,,education,,,wikidata,Q138440603,,,,7.95,-1.02,nonprofit,tier_b,2,,,
716947,Ghana Open Data Initiative,GH,Ghana,,,,,government agency,https://data.gov.gh/,,,energy_digital,,,wikidata,Q16733583,,,,7.95,-1.02,nonprofit,tier_b,3,,,
716554,Ghana Society of Dermatology,GH,Ghana,,,,,"A professional medical society in Ghana dedicated to promoting healthy skin through advocacy, education, training, and treatment of skin disorders.",,,,healthcare,,,wikidata,Q130724618,,,,7.95,-1.02,nonprofit,tier_b,2,,,
716541,Green Roots Initiative,GH,Ghana,,,,,Community-based environmental NGO in Ghana,,,,ecology,,,wikidata,Q139121047,,,,7.95,-1.02,nonprofit,tier_b,2,,,
716484,Human Rights Advocacy Centre,GH,Ghana,,,,,"a not-for-profit, independent, non-partisan, research and advocacy Organization set up to advance and protect human rights in Ghana.",https://www.hracghana.org/,,,democracy,,,wikidata,Q107053743,,,,7.95,-1.02,nonprofit,tier_b,2,,,
