id,name,country_code,country_name,state_province,city,registration_id,registration_type,description,website,email,phone,framework_area,ntee_code,icnpo_code,source,source_id,last_filing_year,annual_revenue,employee_count,lat,lon,model_type,tags,alignment_score,evidence_url,evidence_quote,last_verified_at
763908,Bangladesh Free Trade Union Congress,BD,Bangladesh,,,,labor/union_federation,"ITUC affiliate. BFTUC. 85,000 members.",,,,cooperatives,,,ituc_affiliates,wp:Bangladesh_Free_Trade_Union_Congress,,,,23.68,90.35,labor_union,"labor_union,ituc_affiliate",4,https://en.wikipedia.org/wiki/Bangladesh_Free_Trade_Union_Congress,,
763909,Bangladesh Jatyatabadi Sramik Dal,BD,Bangladesh,,,,labor/union_federation,"ITUC affiliate. BJSD. 180,000 members.",,,,cooperatives,,,ituc_affiliates,wp:Bangladesh_Jatyatabadi_Sramik_Dal,,,,23.68,90.35,labor_union,"labor_union,ituc_affiliate",4,https://en.wikipedia.org/wiki/Bangladesh_Jatyatabadi_Sramik_Dal,,
763910,Bangladesh Labour Federation,BD,Bangladesh,,,,labor/union_federation,"ITUC affiliate. BLF. 102,000 members.",,,,cooperatives,,,ituc_affiliates,wp:Bangladesh_Labour_Federation,,,,23.68,90.35,labor_union,"labor_union,ituc_affiliate",4,https://en.wikipedia.org/wiki/Bangladesh_Labour_Federation,,
763911,Bangladesh Mukto Sramik Federation,BD,Bangladesh,,,,labor/union_federation,"ITUC affiliate. BMSF. 204,000 members.",,,,cooperatives,,,ituc_affiliates,wp:Bangladesh_Mukto_Sramik_Federation,,,,23.68,90.35,labor_union,"labor_union,ituc_affiliate",4,https://en.wikipedia.org/wiki/Bangladesh_Mukto_Sramik_Federation,,
911150,Bangladesh Samabaya Bank Limited (BSBL),BD,,,Dhaka-1000,,,"Bangladesh Samabaya Bank Limited (BSBL) is the apex bank in the co-operative sector of Bangladesh. The members are government, central co-operative banks, land development co-operative banks at district level, other apex co-operative societies and the central co-operative societies situated all over Bangladesh. The functions of BSBL including receiving deposits; issuing bonds, loans, and other agriculture credit to its members; providing loans; and various tasks as and when required by the co-operative department and the government.",http://bsbl.org.bd/,,,cooperatives,,,ica_directory,3528,,,,,,cooperative,ica_member,7,https://lod.coop/ica/3528,,
763912,Bangladesh Sanjukta Sramik Federation,BD,Bangladesh,,,,labor/union_federation,"ITUC affiliate. BSSF. 155,000 members.",,,,cooperatives,,,ituc_affiliates,wp:Bangladesh_Sanjukta_Sramik_Federation,,,,23.68,90.35,labor_union,"labor_union,ituc_affiliate",4,https://en.wikipedia.org/wiki/Bangladesh_Sanjukta_Sramik_Federation,,
764679,Habitat for Humanity Bangladesh,BD,Bangladesh,,Dhaka,,land_and_housing/sweat_equity_program,Habitat for Humanity country or regional office. Sweat-equity homeownership program. See https://habitatbangladesh.org/.,https://habitatbangladesh.org/,,,housing_land,,,habitat_affiliates,BD:habitat-for-humanity-bangladesh,,,,23.68,90.35,sweat_equity_program,"habitat_affiliate,sweat_equity",9,https://habitatbangladesh.org/,,
763913,Jatio Sramik League,BD,Bangladesh,,,,labor/union_federation,"ITUC affiliate. JSL. 150,000 members.",,,,cooperatives,,,ituc_affiliates,wp:Jatio_Sramik_League,,,,23.68,90.35,labor_union,"labor_union,ituc_affiliate",4,https://en.wikipedia.org/wiki/Jatio_Sramik_League,,
911011,National Co-operative Union of Bangladesh (Bangladesh Jatiya Samabaya Union-BJSU),BD,,,Dhaka,,,BJSU is the apex federation representing the cooperative movement in Bangladesh.,,,,cooperatives,,,ica_directory,128,,,,,,cooperative,ica_member,9,https://lod.coop/ica/128,,
