id,name,country_code,country_name,state_province,city,registration_id,registration_type,description,website,email,phone,framework_area,ntee_code,icnpo_code,source,source_id,last_filing_year,annual_revenue,employee_count,lat,lon,model_type,tags,alignment_score,evidence_url,evidence_quote,last_verified_at
902713,Asociace místních potravinových iniciativ,CZ,Czech Republic,,Praha 9,,,"We seek enhancing close relationship to the countryside by the means of local food systems in the Czech Repblic: community supported agriculture (CSA), community gardens etc.. type: food_souvereignity. curated by: Ekumenickaakademie",http://asociaceampi.cz/,info@asociaceampi.cz,+4207746838833,food,,,susy_map,3d35d659da869c49,,,,50.1080098,14.4995598,nonprofit,,7,https://github.com/TransforMap/transformap-viewer/raw/gh-pages/susydata-fallback.json,,
911035,Co-operative Association of the Czech Republic (CACR),CZ,,,Praha 1,,,"CACR is a professional association of legal entities for discussing and dealing with common co-operative issues, for the protection, support and promotion of interests of co-operatives and their members. CACR is the apex, representing the interests of the co-operative system in relation to legislative and executive state bodies and the public.",http://www.dacr.cz,,,cooperatives,,,ica_directory,174,,,,50.09133,14.43619,cooperative,ica_member,9,https://lod.coop/ica/174,,
763590,Czech-Moravian Confederation of Trade Unions,CZ,Czech Republic,,Prague,,labor/national_union,trade union,http://www.cmkos.cz,,,democracy,,,wikidata_unions,Q340104,1990,,,,,labor_union,,4,http://www.wikidata.org/entity/Q340104,,
911298,Ekumenická akademie,CZ,,,,,,"Established in 1996 in the Czech Republic, Ecumenical Academy is an NGO with a vision of a socially just, sustainable and tolerant society. We work on human rights and finding solutions for economic, social, gender and ethnic inequalities. We support alternative forms of economical democracy, such as social solidarity economy (SSE), fair trade, cooperatives. We also organise campaigns and events to raise awareness of these issues. We are a founding member of many Czech social justice organisations and part of several international networks.. founded: 1996. scope: national. member of: RIPESS Europe",http://ekumakad.cz/,office@ekumakad.cz,,cooperatives,,,ripess_family,socioeco:471:844,,,,50.087465,14.421253,cooperative,"ripess_member, RIPESS Europe",10,https://www.socioeco.org/bdf_organisme-844_en.html,,
911323,Fairbio Prazirna,CZ,,,,,,scope: local. member of: RIPESS Europe,https://www.fair-bio.cz/en/,objednavky@fair-bio.cz,,cooperatives,,,ripess_family,socioeco:471:1197,,,,50.087465,14.421253,cooperative,"ripess_member, RIPESS Europe",3,https://www.socioeco.org/bdf_organisme-1197_en.html,,
764450,People's Building and Housing Cooperative in Pilsen,CZ,Czechoslovakia,,,,land_and_housing/housing_cooperative,Czech housing cooperative,http://www.lbdplzen.cz,,,cooperatives,,,wikidata_land_trusts,Q132184654,1912,,,,,cooperative,,7,http://www.wikidata.org/entity/Q132184654,,
764751,People's Building and Housing Cooperative in Pilsen,CZ,Czech Republic,,,,labor/construction_cooperative,Czech housing cooperative,http://www.lbdplzen.cz,,,cooperatives,,,construction_coops,Q132184654,1912,,,,,cooperative,"construction,worker_cooperative",10,http://www.wikidata.org/entity/Q132184654,,
902721,ROH družstevní kavárna,CZ,Czech Republic,,Praha 3,,,ROH cooperative café is a collective project of 10 people and it is run in a cooperative - demokratic way.. type: other_communities. curated by: Ekumenickaakademie,https://www.facebook.com/ROHkavarna/,rohdruzstevnikavarna@gmail.com,+420608729071,,,,susy_map,72c31e32b3b3dd87,,,,50.087127,14.4495723,nonprofit,,6,https://github.com/TransforMap/transformap-viewer/raw/gh-pages/susydata-fallback.json,,
