id,name,country_code,country_name,state_province,city,registration_id,registration_type,description,website,email,phone,framework_area,ntee_code,icnpo_code,source,source_id,last_filing_year,annual_revenue,employee_count,lat,lon,model_type,tags,alignment_score,evidence_url,evidence_quote,last_verified_at
911286,ASEC - Asian Solidarity Economy Council,GLOBAL,Asia,,,,,Asian continental chapter of RIPESS. Domain asec.coop currently unreachable; outreach pending.,https://www.ripess.org/membres/,,,cooperatives,,,ripess_family,apex:asec,,,,,,nonprofit,ripess_apex,6,https://www.ripess.org/membres/,,
911283,RIPESS - Intercontinental Network for the Promotion of Social Solidarity Economy,GLOBAL,Global,,,,,"Intercontinental network of continental SSE networks. RIPESS aggregates RIPESS LAC (Latin America), RAESS (Africa), ASEC (Asia), RIPESS NA (North America), RIPESS EU (Europe), and RIPESS Oceania.",https://www.ripess.org/,,,cooperatives,,,ripess_family,apex:ripess,,,,,,federation,ripess_apex,3,https://www.ripess.org/,,
911288,RIPESS EU - Solidarity Economy Europe,GLOBAL,Europe,,,,,"European continental chapter of RIPESS. Members listed via the socioeco.org mirror, network id 471.",https://www.ripess.eu/,,,cooperatives,,,ripess_family,apex:ripess-eu,,,,,,nonprofit,ripess_apex,3,https://www.ripess.eu/,,
911287,RIPESS NA - North American Network for the Solidarity Economy,GLOBAL,North America,,,,,North America continental chapter of RIPESS. Includes the US Solidarity Economy Network and Canadian co-op networks.,https://www.ripess.org/membres/,,,cooperatives,,,ripess_family,apex:ripess-na,,,,,,federation,ripess_apex,6,https://www.ripess.org/membres/,,
911290,Urgenci - International Network for Community Supported Agriculture,GLOBAL,Global,,,,,"International network of Community Supported Agriculture initiatives, listed alongside RIPESS continental chapters as a partner network.",http://urgenci.net/,,,cooperatives,,,ripess_family,apex:urgenci,,,,,,federation,ripess_apex,2,http://urgenci.net/,,
