logged_at,reason,name,title,url,query
2026-04-22T12:49:07.267321Z,non_org_title,List of non-governmental organizations in China - Wikipedia,List of non-governmental organizations in China - Wikipedia,,"""List of non-governmental organizations in China - Wikipedia"" ""China"" organization"
2026-04-22T12:49:07.822782Z,non_org_title,List of non-governmental organizations in China This article,List of non-governmental organizations in China This article,,"""List of non-governmental organizations in China This article"" ""China"" organization"
2026-04-22T12:49:08.392357Z,non_org_title,"List of Ngos, Charities and non-profits in China - NGO Base","List of Ngos, Charities and non-profits in China - NGO Base",,"""List of Ngos, Charities and non-profits in China - NGO Base"" ""China"" organization"
2026-04-22T12:49:08.955261Z,missing_url,CN/china-ngos,CN/china-ngos,,"""CN/china-ngos"" ""China"" organization"
2026-04-22T12:49:09.492821Z,non_org_title,NGO Directory - China Development Brief,NGO Directory - China Development Brief,,"""NGO Directory - China Development Brief"" ""China"" organization"
2026-04-22T12:49:10.051741Z,missing_url,Recording Civic Action in China - Spotlight Exhibits,Recording Civic Action in China - Spotlight Exhibits,,"""Recording Civic Action in China - Spotlight Exhibits"" ""China"" organization"
2026-04-22T12:49:10.604826Z,non_org_title,Worldwide NGO Directory,Worldwide NGO Directory,,"""Worldwide NGO Directory"" ""China"" organization"
2026-04-22T12:49:11.152374Z,non_org_title,The Worldwide NGO Directory,The Worldwide NGO Directory,,"""The Worldwide NGO Directory"" ""China"" organization"
2026-04-22T12:49:11.704875Z,missing_url,China NGO Network for International Exchanges - cnie.org.cn,China NGO Network for International Exchanges - cnie.org.cn,,"""China NGO Network for International Exchanges - cnie.org.cn"" ""China"" organization"
2026-04-22T12:49:12.271217Z,missing_url,Together to Implement the Global Development Initiative China,Together to Implement the Global Development Initiative China,,"""Together to Implement the Global Development Initiative China"" ""China"" organization"
2026-04-22T12:49:12.818128Z,missing_url,Civil Society Organizations (CSOs) - United Nations Development Programme,Civil Society Organizations (CSOs) - United Nations Development Programme,,"""Civil Society Organizations (CSOs) - United Nations Development Programme"" ""China"" organization"
2026-04-22T12:49:13.368726Z,missing_url,NGO Project - ChinaFile,NGO Project - ChinaFile,,"""NGO Project - ChinaFile"" ""China"" organization"
2026-04-22T12:49:13.916336Z,missing_url,The China NGO Project is a community,The China NGO Project is a community,,"""The China NGO Project is a community"" ""China"" organization"
